Organization Name,Organization Name URL,Headquarters Location,Full Description,Operating Status,Company Type,Last Funding Type,Diversity Spotlight (US Headquarters Only),Founded Date,Founded Date Precision,Industries
NASA,https://www.crunchbase.com/organization/nasa,"Washington, District of Columbia, United States","NASA's vision is to reach for new heights and reveal the unknown so that what we do and learn will benefit all humankind. President Dwight D. Eisenhower established the National Aeronautics and Space Administration in 1958, partially in response to the Soviet Union's launch of the first artificial satellite the previous year. NASA grew out of the National Advisory Committee on Aeronautics (NACA), which had been researching flight technology for more than 40 years. President John F. Kennedy focused NASA and the nation on sending astronauts to the moon by the end of the 1960s. Through the Mercury and Gemini projects, NASA developed the technology and skills it needed for the journey. On July 20, 1969, Neil Armstrong and Buzz Aldrin became the first of 12 men to walk on the moon, meeting Kennedy's challenge. Meanwhile, NASA was continuing the aeronautics research pioneered by NACA. It also conducted purely scientific research and worked on developing applications for space technology, combining both pursuits in developing the first weather and communications satellites. After Apollo, NASA focused on creating a reusable ship to provide regular access to space: the space shuttle. First launched in 1981, the space shuttle flew more than 130 successful flights before retiring in 2011. In 2000, the United States and Russia established permanent human presence in space aboard the International Space Station, a multinational project representing the work of 16 nations. NASA also has continued its scientific research. In 1997, Mars Pathfinder became the first in a fleet of spacecraft that will explore Mars in the next decade, as we try to determine if life ever existed there. The Terra and Aqua satellites are flagships of a different fleet, this one in Earth orbit, designed to help us understand how our home world is changing. NASA's aeronautics teams are focused on improved aircraft travel that is safer and cleaner. Throughout its history, NASA has conducted or funded research that has led to numerous improvements to life here on Earth.",Active,For Profit,,,1958-07-29,day,"Aerospace, National Security, Robotics, Space Travel"
Aerojet Rocketdyne,https://www.crunchbase.com/organization/aerojet-rocketdyne-2ece,"Sacramento, California, United States","Aerojet Rocketdyne manufactures rocket, hypersonic, and electric propulsive systems for aerospace and defense companies that provide propulsion and energetics to customers in the space, missile defense, strategic systems, and tactical missile, and weaponry markets. The real estate business of the aerospace and defense products and systems maker covers activities linked to the entitlement, sale, and leasing of the company's excess real estate assets.",Active,For Profit,Grant,,1942-01-01,year,"Aerospace, Automotive, Machinery Manufacturing, Manufacturing"
The Boeing Company,https://www.crunchbase.com/organization/the-boeing-company,"Chicago, Illinois, United States","The Boeing Company is an American multinational corporation that designs, manufactures and sells fixed-wing aircraft, rotorcraft, rockets and satellites and provides leasing and product support services. Boeing is among the largest global aircraft manufacturers, is the second-largest aerospace & defense contractor in the world based on 2012 revenue and is the US' largest exporter by dollar value. Boeing stock is a component of the Dow Jones Industrial Average. The Boeing Company's corporate headquarters are located in Chicago and the company is led by Chairman and CEO James McNerney. Boeing is organized into five primary divisions: Boeing Commercial Airplanes (BCA), Boeing Defense, Space & Security (BDS), Engineering, Operations & Technology, Boeing Capital and Boeing Shared Services Group. Boeing is the world's largest aerospace company and leading manufacturer of commercial jetliners and defense, space and security systems. A top U.S. exporter, the company supports airlines and U.S. and allied government customers in 150 countries. Boeing products and tailored services include commercial and military aircraft, satellites, weapons, electronic and defense systems, launch systems, advanced information and communication systems, and performance-based logistics and training. Boeing has a long tradition of aerospace leadership and innovation. The company continues to expand its product line and services to meet emerging customer needs. Its broad range of capabilities includes creating new, more efficient members of its commercial airplane family; integrating military platforms, defense systems and the warfighter through network-enabled solutions; creating advanced technology solutions; and arranging innovative customer-financing options. With corporate offices in Chicago, Boeing employs more than 170,000 people across the United States and in 70 countries. This represents one of the most diverse, talented and innovative workforces anywhere. More than 140,000 employees hold college degrees -- including nearly 35,000 advanced degrees -- in virtually every business and technical field from approximately 2,700 colleges and universities worldwide. Our enterprise also leverages the talents of hundreds of thousands more skilled people working for Boeing suppliers worldwide. Boeing is organized into two business units: Boeing Commercial Airplanes and Boeing Defense, Space & Security. Supporting these units are Boeing Capital Corporation, a global provider of financing solutions; the Shared Services Group, which provides a broad range of services to Boeing worldwide; and Boeing Engineering, Operations & Technology, which helps develop, acquire, apply and protect innovative technologies and processes. Divisions: - [Boeing Defense, Space and Security](http://www.crunchbase.com/organization/boeing-defense-space-security) - [Boeing Commercial Airplanes](http://www.crunchbase.com/organization/boeing-commercial-airplanes) - [Boeing Capital Corporation](http://www.crunchbase.com/organization/boeing-capital-corporation) - [Boeing Shared Services Group](http://www.crunchbase.com/organization/boeing-shared-services-group) - [Boeing Engineering, Operations & Technology](http://www.crunchbase.com/organization/boeing-engineering-operations-technology)",Active,For Profit,Grant,,1916-07-15,day,"Aerospace, Manufacturing, National Security, Transportation"
CDI,https://www.crunchbase.com/organization/cdi,"Philadelphia, Pennsylvania, United States","Headquartered in Philadelphia, CDI Corp. (NYSE: CDI) is a leading provider of engineering and information technology outsourcing solutions and professional staffing. Its operating units include CDI Engineering Solutions, CDI IT Solutions, CDI AndersElite Limited, and Management Recruiters International, Inc. With offices throughout North America as well as joint ventures in Kuwait and Mexico, the CDI Engineering Solutions division provides engineering outsourcing, project management and professional services to Global 1000 clients in the aerospace, government services, infrastructure, life sciences and process & industrial markets.",Active,For Profit,Post-IPO Debt,,1950-01-01,year,"Aerospace, Information Technology, Oil and Gas, Software"
AAR Corp,https://www.crunchbase.com/organization/aar-corp,"Wood Dale, Illinois, United States","AAR is a provider of diverse products and services to the worldwide commercial aviation and government/defense industries, they combine a close-to-the-customer business model with a broad range of capabilities to help customers operate more efficiently, lower costs, and maintain high levels of quality, safety, and service.",Active,For Profit,Post-IPO Debt,,1951-01-01,year,"Aerospace, National Security"
Bristow Group,https://www.crunchbase.com/organization/bristow-group,"Houston, Texas, United States","Bristow Group Inc. (Bristow Group) is a provider of helicopter services to the worldwide offshore energy industry based on the number of aircraft operated and one of two helicopter service providers to the offshore energy industry with global operations. Bristow Group has transportation operations in the North Sea, Nigeria and the United States Gulf of Mexico, and in most of the other offshore energy producing regions of the world, including Alaska, Australia, Brazil, Russia and Trinidad. Bristow Group conducts its business in one segment: Helicopter Services. The Helicopter Services segment operations are conducted primarily through five business units: Europe, West Africa, North America, Australia, and Other International. During the fiscal year ended March 31, 2012, the Company generated 82% and 93% of its consolidated operating revenue and business unit operating income, respectively, from operations outside of the United States.",Active,For Profit,Post-IPO Debt,,1955-01-01,year,"Aerospace, Information Services, Service Industry"
Lockheed Martin,https://www.crunchbase.com/organization/lockheed-martin,"Bethesda, Maryland, United States","Lockheed Martin Corporation is a global security company engaged in the research, design, development, manufacture, integration, and sustainment of advanced technology systems and products. It also provides a range of management, engineering, technical, scientific, logistic, and information services. The Company operates in four business segments: Aeronautics, Electronic Systems, Information Systems & Global Services, and Space Systems. Lockheed Martin was formed in 1995 from the merger of Lockheed Corporation and Martin Marietta. In September 2008, Lockheed Martin Corporation acquired Aculight Corporation. In January 2009, it completed its acquisition of Universal Systems & Technology, Inc. (UNITECH). In August 2009, it completed its acquisition of Gyrocam Systems LLC (Gyrocam). Gyrocam develops and supplies gyrostabilized optical surveillance systems and sustainment field services, principally to the United States military. Lockheed Martin Missiles and Fire Control, a unit of the Company's Electronic Systems business area, would manage the Gyrocam business.",Active,For Profit,Post-IPO Equity,,1912-01-01,year,"Aerospace, Cyber Security, Machinery Manufacturing, Military, National Security, Security"
Northrop Grumman Systems Corporation,https://www.crunchbase.com/organization/northrop-grumman-systems-corporation,"Los Angeles, California, United States","Northrop Grumman Systems Corporation creates, develops, manufactures, and supports some of the world's innovative products, including cutting-edge airplanes and next-generation satellites, as well as unequaled cyber security systems and all-seeing radars. Northrop Grumman is present wherever the frontiers of possible are being pushed, whether it's rendering a 200-ton airplane invisible, anticipating cyber attacks before they happen, or unraveling the riddles of the cosmos.",Active,For Profit,Grant,,1939-01-01,year,Aerospace
Eastern Airlines,https://www.crunchbase.com/organization/eastern-airlines-inc,"Wayne, Pennsylvania, United States",Eastern Air Lines is a professional group of airline managers that acquired the intellectual property of Eastern Air Lines to develop a new business plan and financing plan to re-launch the airline. The team developed a multi-level business and financing plan that is being used to raise the capital required for Eastern to certify under FAA Regulation Part 121.,Active,For Profit,Venture - Series Unknown,,1927-01-01,year,"Air Transportation, Public Transportation, Service Industry, Transportation"
Honeywell,https://www.crunchbase.com/organization/honeywell,"Charlotte, North Carolina, United States","Honeywell International is a technology and manufacturing company that offers energy, safety, and security solutions and technologies. It offers aerospace products and services; control technologies for buildings, homes, and industry; automotive products; turbochargers;  specialty chemicals; electronic and advanced materials; process technology for refining and petrochemicals; and energy efficient products and solutions. The company offers energy efficiency benefits across four industry sectors: transportation, commercial buildings, industrial, and residential. Its safety technologies focus on emergency management, flights, and workplace. It offers security and control technologies for industrial, defense, and residential purposes. Honeywell International’s offerings are categorized as consumer and home; aerospace and defense; safety and security; buildings, construction, and maintenance; scanning and mobile productivity; industrial process control; efficiency, energy, and utilities; automotive and transportation; oil and gas, refining, petrochemicals, and biofuels; healthcare and medical; chemicals, specialty materials, and fertilizers; manufacturing; and fire protection and first responder. Honeywell International was founded in 1906 and is based in Morristown, New Jersey.",Active,For Profit,Grant,,1906-01-01,year,"Aerospace, Electronics, Information Technology, Innovation Management, Manufacturing, Service Industry"
PPG Aerospace,https://www.crunchbase.com/organization/ppg-aerospace,"Atlanta, Georgia, United States","The PPG Aerospace portfolio is comprised of a unique group of products and services.Through a series of strategic acquisitions, PPG has assembled a team of industry leaders that builds on its own long history as a transparencies aviation leader, with PRC-DeSoto International for sealants, coatings, and packaging and application systems; Sierracin/Sylmar Corp. for advanced composite transparencies; and Eldorado Chemicals for paint removal and cleaning. Through this exceptional team, PPG is able to deliver what is key to the aviation industry: innovation.",Active,For Profit,Venture - Series Unknown,,1920-01-01,year,"Aerospace, Air Transportation, Chemical, Transportation"
Miami International Airport,https://www.crunchbase.com/organization/miami-international-airport,"Miami, Florida, United States","Miami International Airport is an aviation and aerospace company that provides air services to people traveling to and from Florida. The Miami-Dade Aviation Department operates Miami International Airport (MIA), which is located on 3,230 acres of land near downtown Miami and is owned by the Miami-Dade County government. Miami International Airport has over 90 air carriers and serves flights to Latin America and the Caribbean.",Active,For Profit,Corporate Round,,1928-01-01,year,"Aerospace, Air Transportation, Transportation, Travel"
Aero Bending Company,https://www.crunchbase.com/organization/aero-bending-company,"Palmdale, California, United States","Aero Bending Company is a metal fabrication company that offers tube bending, welding, and torch brazing complete sheet metal support, specializing in clamps, enclosures and brackets.",Active,For Profit,Private Equity,,1944-01-01,year,"Aerospace, Customer Service, Industrial Manufacturing, Manufacturing, Precious Metals"
National Air and Space Museum,https://www.crunchbase.com/organization/national-air-and-space-museum,"Washington, District of Columbia, United States","The National Air and Space Museum of the Smithsonian Institution has the world's biggest and most significant collection of aviation and space objects, including all aspects of human flight, as well as associated works of art and archive materials. It operates two iconic facilities that accommodate more than eight million visitors every year, making it the country's most visited museum. The Center for Earth and Planetary Studies is also housed there.",Active,For Profit,Grant,,1946-01-01,year,"Aerospace, Mobile Apps, Museums and Historical Sites"
Sunvair,https://www.crunchbase.com/organization/sunvair,"Valencia, California, United States","Sunvair specializes in landing gear overhauls and component repairs for both commercial and military aircraft. The Company has built a reputation among leading aircraft operators for high quality, responsive customer service and rapid turnaround.",Active,For Profit,Debt Financing,,1956-01-01,year,"Aerospace, Industrial Manufacturing, Machinery Manufacturing"
San Antonio International Airport,https://www.crunchbase.com/organization/san-antonio-international-airport,"San Antonio, Texas, United States","San Antonio International Airport is an airport. They offer airport services for travellers, including flights, parking, ground transportation, traveller assistance, flight status, rental cars, taxi cabs, ride-sharing, public transportation, and more.",Active,For Profit,Grant,,1941-07-01,month,"Aerospace, Air Transportation, Parking, Ticketing"
Albany International Airport,https://www.crunchbase.com/organization/albany-international-airport,"Albany, New York, United States","Albany International Airport offers commercial airline services and air cargo services. Their airport includes recent improvements to the terminal and a new parking garage. Their commercial airline services include Allegiant Airlines, American Airlines, Delta Airlines, Frontier Airlines, JetBlue, Southwest Airlines, and United Airlines. Albany International Airport is the smart airport of the future, leading the industry with innovative practices and procedures to ensure a simple, safe, and clean travel experience for everyone.",Active,For Profit,Grant,,1928-01-01,year,Air Transportation
Frost & Sullivan,https://www.crunchbase.com/organization/frost-sullivan,"Mountain View, California, United States","Frost & Sullivan enables clients to accelerate growth and achieve best-in-class positions in growth, innovation and leadership. The company's Growth Partnership Service provides the CEO and the CEO's Growth Team with disciplined research and best-practice models to drive the generation, evaluation, and implementation of powerful growth strategies. We leverage 50 years of experience in partnering with Global 1000 companies, emerging businesses and the investment community from over 40 offices on six continents.",Active,For Profit,,,1961-01-01,year,"Aerospace, Automotive, Consulting, Information Technology, Internet, Marketing, Military, Security"
Textron,https://www.crunchbase.com/organization/textron,"Providence, Rhode Island, United States","Textron Inc. is a multi-industry company that leverages its global network of aircraft, defense, industrial and finance businesses to provide customers with innovative solutions and services. Textron is known around the world for its powerful brands such as Bell Helicopter, Cessna Aircraft Company, Jacobsen, Kautex, Lycoming, E-Z-GO, Greenlee, and Textron Systems.",Active,For Profit,,,1923-01-01,year,"Aerospace, Finance, Industrial"
Burke Aerospace,https://www.crunchbase.com/organization/burke-aerospace,"Farmington, Connecticut, United States","Burke Aerospace is an aerospace and defense manufacturing company that offers electric discharge machining and milling services to the aerospace, industrial gas turbine (IGT), and defense industries. It provides CNC sinker electric discharge machining (EDM), wire electric discharge machining (WEDM), high-speed hole (HSH), airflow testing, and 5 axis milling services. TTi provides all EDM and milling solutions for turbine blades/buckets, vanes/nozzles, shrouds, combustor components, engine cases, and ring segments. The company has earned wide recognition for high quality, responsiveness, and lean enterprise that adds value and satisfies customers. It is headquartered in Farmington, Connecticut in 1963.",Active,For Profit,Debt Financing,,1963-01-01,year,"Aerospace, Industrial, Manufacturing"
Moog,https://www.crunchbase.com/organization/moog,"East Aurora, New York, United States","Moog Inc. is a worldwide designer, manufacturer, and integrator of precision motion control products and systems. Moog's high-performance systems control military and commercial aircraft, satellites and space vehicles, launch vehicles, missiles, industrial machinery, wind energy, marine applications, and medical equipment.",Active,For Profit,,,1951-01-01,year,"Aerospace, Industrial, National Security"
FDH Aero,https://www.crunchbase.com/organization/fdh-aero,"El Segundo, California, United States","FDH Aero is a distributor of c-class hardware and replacement parts to commercial and defense aircraft manufacturers, subcontractors, component distributors, and MRO/aftermarket solution providers.",Active,For Profit,,,1964-01-01,year,"Aerospace, Industrial, Manufacturing"
Air Industries Group,https://www.crunchbase.com/organization/air-industries-group,"Bay Shore, New York, United States","Air Industries Group (AIRI) is an integrated manufacturer of precision equipment assemblies and components for leading aerospace and defense prime contractors. Air Industries designs and manufactures flight critical products including flight safety parts, landing gear and components, arresting gear, flight controls, sheet metal fabrications, and ground support equipment.",Active,For Profit,Post-IPO Equity,,1959-01-01,year,"Aerospace, Manufacturing, National Security"
Sonfarrel Aerospace,https://www.crunchbase.com/organization/sonfarrel-aerospace,"Anaheim, California, United States","Son-Aero is a manufacturer of aerospace and defense parts and helps with aerospace or defense projects. The company produces commercial parts intended for the aerospace industry. Its manufacturing capabilities offer elastomeric seals and rubber molding, machining, plastic injection, and compression molding, enabling clients to get access to a variety of good quality aerospace components. The Anaheim, California-based company was founded in 1955.",Active,For Profit,Venture - Series Unknown,,1955-01-01,year,"Aerospace, Machinery Manufacturing, Manufacturing"
United States Air Force,https://www.crunchbase.com/organization/united-states-air-force,"Washington, District of Columbia, United States","The United States Air force is the aerial arm of the armed forces of the United States of America. The Air Force provides compelling air, space, and cyber capabilities for use by the combatant commanders of the U.S. armed forces. The Air Force maintains a size of over 330,000 active personnel in its ranks with over 5,000 aircrafts. The Air Force also maintains 63 satellites. The annual budget of the force is over US$ 140 billion.   The United States Air Force was formed in 1947 by the National Security Act and has been deployed in many major conflicts around the world. Besides its combat role, the U.S. Air Force is also a major contributor to relief and aid operations around the world. The United States Air Force has its headquarters at the Pentagon in Virginia.",Active,For Profit,,,1951-01-01,year,"Aerospace, Medical, National Security"
Raytheon,https://www.crunchbase.com/organization/raytheon,"Waltham, Massachusetts, United States","Raytheon Technologies is an aerospace and defense company that provides advanced systems and service for commercial, military, and government customers. The company is pushing the boundaries of avionics, cybersecurity, directed energy, electric propulsion, hypersonics, quantum physics, and more.",Active,For Profit,Grant,,1922-07-07,day,"Aerospace, Manufacturing, National Security, Security, Sensor, Telecommunications, Training"
NetJets,https://www.crunchbase.com/organization/netjets,"Columbus, Ohio, United States","NetJets Two decades after making an indelible mark on human history in World War II, three retired military pilots set out to change the course of aviation history. It was fifty years ago, 1964, that U.S. Air Force Generals Curtis LeMay and Paul Tibbets, with U.S. Army Air Corpsman Bruce Sundlun, partnered to give birth to NetJets’ forerunner, Executive Jet Aviation, one of the world’s first aircraft management businesses. With retired Air Force Brigadier General Dick Lassiter serving as president and chairman of the board – not to mention founding partners such as entertainers James Stewart and Arthur Godfrey – They were in quite capable hands right from the start. And They’ve been pioneers ever since. In 1984, when Richard Santulli purchased EJA and created the NetJets program – and with it, the concept of fractional ownership – They truly cemented Their place in the record books. In the following years, They grew steadily and constantly looked for new ways to ensure They provided the best safety and service for Their Owners: new aircraft, new facilities, new global programs. In 1995, Warren Buffett joined NetJets as a customer; by 1998, he was so impressed with the operation that he bought the company, adding it to the Berkshire Hathaway empire. From then on, with Berkshire’s backing, NetJets has had unmatched resources to invest in whatever it takes to always be the best and safest player in the industry. Today, NetJets continues to uniquely and expertly fill a crucial need – helping Their Owners save time in order to take care of what’s most important in their lives. And as They nurture a nascent operation in China, add state-of-the-art Signature Series™ aircraft worldwide, and take any and all steps to provide the most seamless and enjoyable travel experience possible, you can bet that They will continue to live up to Their promise.",Active,For Profit,,,1964-01-01,year,"Aerospace, In-Flight Entertainment, Privacy"
