Wellman,https://www.crunchbase.com/organization/wellman,"Creston, Iowa, United States",WDC Acquisition specializes in manufacturing premium grade aluminum and magnesium sand castings.,Active,For Profit,Venture - Series Unknown,,1910-01-01,year,"Aerospace, Industrial Engineering, Manufacturing"
Rotor X,https://www.crunchbase.com/organization/rotor-x-aircraft,"Chandler, Arizona, United States",Rotor X supplies aircraft components to defence contractors for advanced tactics. It involves the manufacturing of customised aircraft and helicopter kits. They support the existing helicopter owners around the world with parts and maintenance services. An online inquiry form is available on their websites.,Active,For Profit,Non-equity Assistance,,1961-01-01,year,"Aerospace, Machinery Manufacturing, Manufacturing"
Skurka Aerospace,https://www.crunchbase.com/organization/skurka-aerospace,"Camarillo, California, United States","Skurka Aerospace, Inc (SAI) is an ISO 9001/AS 9100 certified and world-renowned designer, developer and producer of custom electro-magnetic equipment.  SAI was founded in 1950, and has extensive experience supporting commercial and military OEM’s and Tier 1 Suppliers. Our success is directly attributable to quality product and cutting edge technology developed for high reliability and mission-critical applications. SAI achieves ongoing advantages in design, development, and manufacturing of customized electro-magnetic equipment which includes: specialized A.C and D.C electric motors, starter generators, speed pickup transducers, fans, blowers, and tachometers for commercial aircraft, military aircraft and ground vehicles, antenna drive systems, naval ships systems, and space exploration systems.",Active,For Profit,,,1950-01-01,year,"Aerospace, Manufacturing"
Limco Airepair,https://www.crunchbase.com/organization/limco-airepair,"Tulsa, Oklahoma, United States","Limco Airepair, Inc., located in Tulsa OK, is recognized as a world leader in the Heat Transfer Solution business with primary focus on the Aerospace Industry.  We are uniquely poised as a total solution provider as BOTH a premier manufacturer of original designs for Military, Regional, and Commercial applications; and an FAA/EASA approved repair station for Maintenance, Repair, and Overhaul (MRO) of Heat Exchanger’s. Their complete manufacturing line services some of the biggest names in Commercial and Military aircraft, and land systems.  And once you experience their dedication to on-time delivery, and 0 defects you will understand why customers such as Boeing have rated us as a GOLD supplier for 44 consecutive months. Their customers rave about their Industry Leading turnaround time in their repair facility.  Where most MRO shops for heat transfer have long lead times, Limco consistently strives to beat their current average of <10 calendar days. They accomplish this by employing lean manufacturing processes, and couple it with their unique skills in vacuum brazing to accomplish an FAA approved process of LimCore™ restoring the unit back to zero time and in full compliance with the Original Equipment Manufacturers specifications.",Active,For Profit,,,1946-01-01,year,"Aerospace, Manufacturing"
Harlow Aerostructures,https://www.crunchbase.com/organization/harlow-aerostructures,"Wichita, Kansas, United States","Harlow Aerostructures LLC is an experienced manufacturer of complex structural, mechanical and electro-mechanical assemblies. This core competency is fully supported by their complete engineering, manufacturing and processing capabilities which provides the vertical integration they need to manage and control the diverse mix of complex components required to build precision assemblies. A number of their assemblies are some of the most complex in the aircraft industry, including complete Cockpit Pedestals, Electro-Mechanical Throttle Quadrants and Tee Column weld assemblies that all include Harlow produced Wire Harnesses which are functionally tested in-house ready for installation on the assembly line. Finally, their assembly capabilities are complete with their ability to fabricate complex Sheet Metal & Structural assemblies as well as provide Kitting services that makes available a high level of integration capabilities for their customers.",Active,For Profit,,,1954-01-01,year,"Aerospace, Manufacturing, Mechanical Engineering"
Dayton-Granger,https://www.crunchbase.com/organization/dayton-granger,"Fort Lauderdale, Florida, United States",,Active,For Profit,,,1943-01-01,year,"Aerospace, Electronics, Lighting, Manufacturing"
B&B Manufacturing,https://www.crunchbase.com/organization/b-b-manufacturing-1070,"Valencia, California, United States",,Active,For Profit,,,1959-01-01,year,"Aerospace, Automotive, Machinery Manufacturing, Manufacturing"
FlyKci.com,https://www.crunchbase.com/organization/flykci-com,"Kansas City, Missouri, United States",,Active,For Profit,,,1927-01-01,year,"Air Transportation, Information Services, Ticketing, Transportation"
Skills,https://www.crunchbase.com/organization/skills-a44d,"Auburn, Alabama, United States",,Active,For Profit,,,1966-01-01,year,"Aerospace, Manufacturing, Mechanical Engineering, Technical Support"
ALPA,https://www.crunchbase.com/organization/alpa,"Washington, District of Columbia, United States","The Air Line Pilots Association, International (ALPA) is a labor union for airline pilots that offers its members with financial analysis, in-depth knowledge of the Railway Labor Act, the legal experience to defend pilot contracts, and pension and insurance guarantees. The association represents more than 51,000 pilots at 30 U.S. and Canadian airlines. The association is chartered by the AFL-CIO and the Canadian Labour Congress. It is a member of the International Federation of Air Line Pilot Associations. The association’s can discuss about matters concerning their salaries, benefits, security levels, and working conditions. At all levels of ALPA, pilots make decisions through the democratic process. The Air Line Pilots Association, International offers resources such as ALPA-PAC, Pilot Partisan blog, white papers, ALPA testimony, press room, President’s corner, and Airline Pilot Magazine. It provides pilot advocates exclusively for its members. The Air Line Pilots Association, International was founded in 1931 and is based in Washington, D.C., United States with offices in Ontario, Minnesota, California, Hawaii, Texas, Georgia, Virginia, Illinois, and more.",Active,For Profit,,,1931-01-01,year,Aerospace
Sifco Industries,https://www.crunchbase.com/organization/sifco-industries,"Cleveland, Ohio, United States",SIFCO Industries is a world-wide provider of highly engineered forged components to the Aerospace and Energy markets. They supply flight-critical forged components and machined assemblies to all of the leading aircraft and engine manufacturers in the world. These components can be found on virtually all of the commercial and military fixed-wing aircraft as well as helicopters and business jets.,Active,For Profit,,,1913-01-01,year,Aerospace
G.S Precision,https://www.crunchbase.com/organization/g-s-precision,"Brattleboro, Vermont, United States",G.S Precision manufactures of high-precision machined components and complex assemblies for the Aerospace and Defense Industries.,Active,For Profit,,,1958-01-01,year,"Aerospace, Machinery Manufacturing, Manufacturing"
Experimental Aircraft Association,https://www.crunchbase.com/organization/experimental-aircraft-association,"Oshkosh, Wisconsin, United States","Experimental Aircraft Association is an international organization that aims to promote and support recreational flying. EAA has expanded its mission of growing participation in aviation to include antiques, classics, warbirds, aerobatic aircraft, ultralights, helicopters, and contemporary manufactured aircraft. Experimental Aircraft Association was founded in January 1953 and is based in Oshkosh, Wisconsin.",Active,For Profit,,,1953-01-26,day,Aerospace
Desser Holdings,https://www.crunchbase.com/organization/desser-holdings,"Montebello, California, United States","Dasser Holdings is an aviation distributor, maintenance, repair and overhaul provider, as well as a provider of PMA products and DER repairs to OEM and aftermarket customers. The company also manufactures a broad range of other aftermarket products including aviation transparencies, hydraulic hose assemblies, starter-generator components and more. They are dedicated to creating exceptional value through innovative and comprehensive product and service solutions.",Active,For Profit,,,1920-01-01,year,"Aerospace, Machinery Manufacturing, Manufacturing"
Auto-Valve,https://www.crunchbase.com/organization/auto-valve,"Dayton, Ohio, United States","Auto-Valve is a fluid systems component specialist Company, for the past 65 years AVI, as the company is commonly known, has provided components for almost every US manufacturer as well as many international companies, also is an aerospace engineering and manufacturing company. AVI specializes in designing and manufacturing valves for aircraft fuel, hydraulic, and other fluid system components.",Active,For Profit,,,1947-01-01,year,"Aerospace, Fuel, Machinery Manufacturing, Manufacturing"
STS Aerospace,https://www.crunchbase.com/organization/sts-aerospace,"Laconia, New Hampshire, United States","STS Aerospace is an aviation and aerospace component manufacturing company. They provide customers with complete fluid transfer solutions in PTEE flexible, rigid, or flex-rigid hybrid assemblies. The company provides superior flexible hoses and complex rigid assemblies and provides overhaul and repair capabilities.",Active,For Profit,,,1916-01-01,year,"Aerospace, Industrial Engineering, Industrial Manufacturing, Manufacturing"
Air Wisconsin Airlines,https://www.crunchbase.com/organization/air-wisconsin-airlines,"Appleton, Wisconsin, United States",,Active,For Profit,,,1965-01-01,day,"Aerospace, Travel"
Technology Service Corporation,https://www.crunchbase.com/organization/technology-service-corporation,"Arlington, Virginia, United States",,Active,For Profit,,,1966-01-01,day,"Aerospace, Air Transportation"
Heath Tecna,https://www.crunchbase.com/organization/heath-tecna,"Bellingham, Washington, United States","Heath Tecna, Inc. designs, manufactures, and supplies interior products for the passenger aircraft industry worldwide. The company offers a range of furniture, monuments, and other cabin furnishings, including coat closets and other stowages, VCC units, workstations, lavatories, bar units, sofas, cabin dividers, supplementary seat furniture, and more.",Active,For Profit,,,1950-01-01,year,"Aerospace, Manufacturing"
AeroParts,https://www.crunchbase.com/organization/aeroparts-33e0,"Rio Rancho, New Mexico, United States",,Active,For Profit,,,1960-01-01,year,"Aerospace, Industrial Manufacturing, Manufacturing"
Applied Ceramics,https://www.crunchbase.com/organization/applied-ceramics-b830,"Atlanta, Georgia, United States","Applied Ceramics provides value through performance, cost savings, new product development or customized solutions. ACI originally provided primarily alumina and zirconia kiln furniture and special refractory shapes. They focus on their customer’s goals, they create value through their ceramic, refractory, catalyst, tooling, sourcing, manufacturing and research and development expertise.",Active,For Profit,,,1967-01-01,year,"Aerospace, Automotive, Electronics, Manufacturing, Medical"
KELCO Industries,https://www.crunchbase.com/organization/kelco-industries,"Woodstock, Illinois, United States","Kelco Industries is a four divisions, one mission. guardian electric, western consolidated technologies, flex-weld / KEFLEX, and advanced molding technologies provide precision-engineered components to medical, renewable energy, aerospace, automotive, military, and many other industries.",Active,For Profit,,,1931-01-01,year,"Aerospace, Industrial Manufacturing, Manufacturing"
Ensinger Industries,https://www.crunchbase.com/organization/ensinger-industries,"Anaheim, California, United States",,Active,For Profit,,,1966-01-01,year,"Aerospace, Automotive, Industrial Engineering, Manufacturing, Plastics and Rubber Manufacturing"
Container Research Corporation,https://www.crunchbase.com/organization/crc,"Aston, Pennsylvania, United States","CRC designs and manufactures steel and aluminium containers. CRC provides initial design to full-service production and testing of metal reusable shipping and storage containers, assembly and maintenance platforms, and medium and large weldments for the aerospace, defence, transportation, nuclear, alternative energy, and commercial industries.",Active,For Profit,,,1956-01-01,year,"Aerospace, Manufacturing, Product Design, Test and Measurement"
Hytek Finishes,https://www.crunchbase.com/organization/hytek-finishes,"Kent, Washington, United States",,Active,For Profit,,,1957-01-01,year,"Aerospace, Industrial Engineering, Manufacturing"
Norcatec,https://www.crunchbase.com/organization/norcatec,"Garden City, New York, United States","NorcaTec is dedicated to providing spare parts, logistics, and material supply chain support for manufactured military fixed and rotary-wing aircraft to operators and maintenance service providers. Through global engineering, procurement, light manufacturing, and materials management, this company provides a global solution for the support and sustainment of strategic military assets.",Active,For Profit,,,1946-01-01,year,"Aerospace, Manufacturing, Military, Technical Support"
New Hampshire Ball Bearings,https://www.crunchbase.com/organization/new-hampshire-ball-bearings,"Peterborough, New Hampshire, United States","New Hampshire Ball Bearings, Inc. manufactures ball bearings and bearing assemblies for aerospace, defense, medical, dental, and high technology markets. The company’s products include ball bearings, roller bearings, spherical bearings, loader slot bearings, rod end bearings, sleeve bearings, airframe control bearings, and custom bearings and assemblies. It also offers Oscimax, a machinable self-lubricating liner technology to reduce wear, resist corrosion, and moisture; INVINSYS, a bearing technology for wear resistance, operating life, and corrosion and moisture resistance; and Vulkyn that is useful for military and commercial aero engine applications in which bearings are exposed to sustained operating temperatures above 350°F.",Active,For Profit,,,1946-01-01,year,"Aerospace, Machinery Manufacturing, Manufacturing, Medical"
Hawthorne Global Aviation Services,https://www.crunchbase.com/organization/hawthorne-global-aviation-services,"North Charleston, South Carolina, United States","Hawthorne Global Aviation Services is a premier provider of general aviation services, with a rich history in the industry dating back to 1932. Hawthorne operates six premier Fixed Based Operators (FBO), including Long Island MacArthur Airport in Islip, NY (KISP), Cobb County International Airport in Atlanta, Ga.",Active,For Profit,,,1932-01-01,year,Air Transportation
Aero Center Epps Atlanta,https://www.crunchbase.com/organization/epps-aviation-3c01,"Atlanta, Georgia, United States","Aero Center Epps Atlanta is an independent full-service FBO that provides comprehensive aviation services such as 6 charter aircraft, maintenance, avionics, nondestructive testing, and aircraft sales.",Active,For Profit,,,1965-01-01,year,"Aerospace, Manufacturing, Transportation"
P D I Ground Support Systems,https://www.crunchbase.com/organization/p-d-i-ground-support-systems,"Solon, Ohio, United States","P D I Ground Support Systems is original equipment manufacturers of weapons and aircraft support equipment. Founded in 1962 as Prototype Development Incorporated, PDI Ground Support Systems has evolved into a designer and manufacturer of weapons handling systems and ground support equipment used primarily by the United States Air Force, Navy and Army Special Operations Command, in addition to 45 allied air forces worldwide. In May 2018, PDI was awarded the President's ""E"" Award for export excellence at a ceremony held in Washington, DC, USA.  PDI's major product lines include Munitions Trailers, Aircraft Engine Trailers, Weapons Transport Containers and Counter Measure Modules, and Running Gear and Axle Systems. The Company is ISO 9001:2015 certified and is recognized for its dedication to quality.",Active,For Profit,,,1962-01-01,year,"Aerospace, Manufacturing, Mechanical Engineering"
Magnaghi Aeronautica,https://www.crunchbase.com/organization/magnaghi-aeronautica-s-p-a,"Naples, Florida, United States","Magnaghi Aerospace Group is a provider of landing gear systems and composite aerostructure components to helicopter and medium-sized aircraft platforms. Innovation, Integration, Influence. Over 80 years of leadership in the aerospace sector collaborating with the industry’s  Giants.",Active,For Profit,Private Equity,,1936-01-01,year,"Aerospace, Industrial, Machinery Manufacturing, Manufacturing, Mechanical Engineering, Technical Support"
"Electro-Methods, Inc",https://www.crunchbase.com/organization/electro-methods-inc,"South Windsor, Connecticut, United States",,Active,For Profit,,,1965-01-01,year,"Aerospace, Manufacturing"
Philadelphia International Airport (PHL),https://www.crunchbase.com/organization/philadelphia-international-airport-phl,"Philadelphia, Pennsylvania, United States",,Active,For Profit,Grant,,1940-01-01,day,Air Transportation
Reinhold Industries Inc,https://www.crunchbase.com/organization/reinhold-industries-inc,"Santa Fe Springs, California, United States",,Active,For Profit,,,1928-01-01,day,"Aerospace, Manufacturing, Mechanical Engineering"
Hall Industries,https://www.crunchbase.com/organization/hall-industries,"Ellwood City, Pennsylvania, United States","Hall Industries is a supplier of aviation ground support products and services. They provide engineering, manufacturing, and business platforms for aviation, bridge, material handling, construction, electrical, industrial, medical, mining, and power generation.  Their equipment includes CNC, milling equipment, fabrication equipment, technology, and software.",Active,For Profit,,,1966-01-01,year,"Aerospace, Industrial, Industrial Manufacturing, Machinery Manufacturing, Manufacturing, Mechanical Engineering"
Farren International,https://www.crunchbase.com/organization/farren-international,"Ledgewood, New Jersey, United States",,Active,For Profit,,,1959-01-01,year,"Air Transportation, Logistics, Transportation, Warehousing"
RSA Engineered Products,https://www.crunchbase.com/organization/rsa-engineered-products,"Simi Valley, California, United States","RSA Engineered Products (RSA), a manufacturer of complex, highly-engineered and proprietary air ducting products, connectors and related components for air management systems used in aerospace and defense applications.",Active,For Profit,,,1956-01-01,year,"Aerospace, Civil Engineering, Manufacturing"
Tighitco,https://www.crunchbase.com/organization/tighitco,"Ladson, South Carolina, United States",,Active,For Profit,,,1944-01-01,year,"Aerospace, Technical Support"
REDAR,https://www.crunchbase.com/organization/redar,"Tucson, Arizona, United States",,Active,For Profit,,,1948-01-01,year,"Aerospace, Industrial, Manufacturing, Plastics and Rubber Manufacturing"
Trutron Corporation,https://www.crunchbase.com/organization/trutron-corporation,"Troy, Michigan, United States",,Active,For Profit,,"Women Founded, Women Led",1967-01-01,year,"Aerospace, Automotive, Industrial Engineering, Industrial Manufacturing, Machinery Manufacturing, Manufacturing"
Projects,https://www.crunchbase.com/organization/projects-bf43,"Glastonbury, Connecticut, United States",,Active,For Profit,,,1959-01-01,year,"Aerospace, Industrial Automation, Manufacturing, Sales"
Univair Aircraft Corporation,https://www.crunchbase.com/organization/univair-aircraft-corporation,"Aurora, Colorado, United States","Univair Aircraft Corporation produces aircraft replacement parts. They offer products like Aeronca, Cessna, engine parts, hardware, instruments, gauges, pipes, and more. They mainly focus on classic airplane parts.",Active,For Profit,,,1946-01-01,year,"Aerospace, Manufacturing, Sales"
Bomco,https://www.crunchbase.com/organization/bomco,"Gloucester, Massachusetts, United States","Bomco provides aerospace, industrial gas turbine components, land, and marine components. Their capabilities include forming, machining, non-conventional machining, welding, joining, and engineering.",Active,For Profit,,,1958-01-01,year,"Aerospace, Industrial, Manufacturing, Mechanical Engineering, Product Design"
Autoquip,https://www.crunchbase.com/organization/autoquip,"Guthrie, Oklahoma, United States","Autoquip is designed and built standard and custom lift equipment for major industries worldwide.  In doing so, they have established ourselves as the leader in custom material handling equipment. They  allows us to ensure quality, flexible product offering, and responsiveness to our customer’s needs.  Custom lifting solutions is what they do best, and putting their customers in position to succeed is what we deliver.",Active,For Profit,,,1947-01-01,year,"Aerospace, Agriculture, Manufacturing"
Savannah/Hilton Head International Airport,https://www.crunchbase.com/organization/savannah-airport-commission,"Savannah, Georgia, United States",,Active,For Profit,,,1953-01-01,year,"Aerospace, Air Transportation, Travel"
Proponent,https://www.crunchbase.com/organization/proponent,"Brea, California, United States",,Active,For Profit,,,1946-01-01,day,Aerospace
SantoLubes,https://www.crunchbase.com/organization/santolubes,"Spartanburg, South Carolina, United States",,Active,For Profit,,,1962-01-01,year,"Aerospace, Chemical, Electronics, Manufacturing"
AMR Corporation,https://www.crunchbase.com/organization/amr-corporation,"Fort Worth, Texas, United States","AMR Corporation is a commercial aviation business and airline holding company. It is the parent company of American Airlines, American Eagle Airlines, AmericanConnection, and Executive Airlines.   AMR Corporation’s main subsidiary, American Airlines is one of the largest airlines in the world. Together with its sister company, American Eagle and a regional carrier that operates as AmericanConnection under contract, American Airlines serves more than 330 destinations in 50+ countries in the Americas, Europe, and Asia Pacific. The overall fleet exceeds 880 aircrafts. American Airlines also operates more than 600 jets. The carrier extends its geographic reach through code-sharing arrangements and is part of the Oneworld Alliance, along with British Airways, Cathay Pacific, Iberia, Qantas, and others.   AMR Corporation was founded in 1982 and is headquartered in Fort Worth, Texas.",Active,For Profit,,,1926-01-01,year,Aerospace
United Cargo,https://www.crunchbase.com/organization/united-cargo,"Chicago, Illinois, United States","United Cargo delivers business-friendly service via the cargo capacity of the world’s most comprehensive route network – nearly 4,500 flights a day to 339 airports operated by United Airlines and United Express. United operates a mainline fleet of more than 720 aircraft, including 170 wide-bodies, and United Cargo carried over 3.2 billion cargo ton-miles in 2017. United Cargo has specialists available to answer your questions about using this website, booking shipments, billing inquiries, and more. Their agents are available from 0600 to 2300 central time Monday through Friday and 0900 to 1730 central time on Saturday and Sunday.",Active,For Profit,,,1926-01-01,year,"Aerospace, Logistics, Supply Chain Management, Transportation"
C.F. Roark Welding & Engineering,https://www.crunchbase.com/organization/c-f-roark-welding-engineering,"Brownsburg, Indiana, United States",,Active,For Profit,,,1949-01-01,year,"Aerospace, Industrial, Sales"
Rodelco Electronics,https://www.crunchbase.com/organization/rodelco-electronics,"Ronkonkoma, New York, United States","Rodelco Electronics delivers custom RF and microwave frequency synthesizers, receivers, and exciters to the military and aerospace marketplace. They also provide amplifiers, control components, and converters.",Active,For Profit,,,1967-01-01,year,"Aerospace, Electronics, Hardware, Lighting"
Umpco,https://www.crunchbase.com/organization/umpco,"Garden Grove, California, United States","Umpco produces a wide range of superior-quality clamps, clips, and brackets for a variety of industrial applications. Since their products have become the standard for the original equipment on cars, trucks, trailers, and motor homes, they remain the first choice in the aerospace, aircraft, and defence industries where quality and consistency are imperative. Its initial focus was almost exclusively on products and services for the defence sector, and the Umpco name appeared on high-quality clamps, clips, and brackets.",Active,For Profit,,,1963-01-01,year,"Aerospace, Building Material, Hardware, Manufacturing"
AAI Corporation,https://www.crunchbase.com/organization/aai-corporation,"Hunt Valley, Maryland, United States",AAI Corporation is an aerospace and defense development and manufacturing firm.,Active,For Profit,,,1950-01-01,year,"Aerospace, Manufacturing"
Aircraft Owners and Pilots Association,https://www.crunchbase.com/organization/aircraft-owners-and-pilots-association,"Frederick, Maryland, United States","Aircraft Owners and Pilots Association provides products and services to reach media platforms and aviation technology and products that pilots use to travel. They also provide advocacy, services, and products. They maintain a network of pilots to monitor airports.",Active,For Profit,,,1939-05-15,day,"Aerospace, Public Transportation, Transportation"
