Orcon Corporation,https://www.crunchbase.com/organization/orcon-corporation,"Clayton, California, United States",,Active,For Profit,,,1962-01-01,year,Aerospace
Heany Industries,https://www.crunchbase.com/organization/heany-industries,"Scottsville, New York, United States",,Active,For Profit,,,1932-01-01,day,"Aerospace, Industrial Manufacturing, Machinery Manufacturing, Manufacturing"
Eagle Aviation,https://www.crunchbase.com/organization/eagle-aviation,"West Columbia, South Carolina, United States",,Active,For Profit,,,1967-01-01,day,Aerospace
Sherwin Incorporated,https://www.crunchbase.com/organization/sherwin-incorporated,"South Gate, California, United States",Sherwin Incorporated manufactures the Dubl-Chek line of liquid dye inspection penetrants. They offer Dubl-Chek visible penetrants throughout the welding and nuclear power industries.,Active,For Profit,,,1964-01-01,year,"Aerospace, Manufacturing, Nuclear, Quality Assurance"
Micro Craft,https://www.crunchbase.com/organization/micro-craft-2,"Tullahoma, Tennessee, United States","Micro Craft specializes in the manufacture and assembly of parts for various facets of the aerospace industry. From production to spares, to flight test hardware, Micro Craft excels in quality, delivery and short turn-arounds. ITAR compliant company that is also implementing enhanced protection controls, providing increased security that will meet future CMMC accreditation criteria.",Active,For Profit,,,1958-01-01,year,"Aerospace, Air Transportation, Manufacturing"
Aircraft Bluebook,https://www.crunchbase.com/organization/aircraft-bluebook,"Shawnee Mission, Kansas, United States",,Active,For Profit,,,1949-01-01,year,"Aerospace, Database, Online Portals"
H&S Sales Inc.,https://www.crunchbase.com/organization/h-s-sales-inc,"Buffalo, New York, United States","H&S sales Inc. was founded in 1952 and distribute quality production and maintenance fasteners, packaging services, and innovative inventory solutions to a wide variety of manufacturers and service organizations across the USA. H&S is an ISO 9001-2008 Quality Certified enterprise.",Active,For Profit,,,1952-01-01,year,"Aerospace, Automotive, Manufacturing, Oil and Gas"
Temsco Helicopters,https://www.crunchbase.com/organization/temsco-helicopters,"Ketchikan, Alaska, United States",,Active,For Profit,,,1958-01-01,year,Aerospace
Central Flying Service,https://www.crunchbase.com/organization/central-flying-service,"Little Rock, Arkansas, United States","Central Flying Service has been serving the aerospace and aviation community that involves sales, maintenance, repair, overhaul, flight training, avionics, and charter. Central Flying Service offers the finest quality service in general aviation. Central Flying Service allowing everyone to manage their training program around work, weather, and aircraft maintenance.",Active,For Profit,,,1939-01-01,year,"Aerospace, Interior Design, Sales, Training, Transportation"
The Structures Company,https://www.crunchbase.com/organization/the-structures-company,"Seal Beach, California, United States",,Active,For Profit,,,1903-12-17,day,"Aerospace, Recruiting, Staffing Agency"
Quality Honeycomb,https://www.crunchbase.com/organization/quality-honeycomb,"Arlington, Virginia, United States","Quality Honeycomb develop and manufacture thin-gauge, high-temperature welded honeycombs. They manufacture the honeycomb configurations needed for virtually every aircraft engine. Their products are used in stationery gas turbines, steam turbines and compressors. They manufacture honeycomb for use in flow straighteners, energy absorbers, flame arrestors, collimators, sound suppressors, radio frequency shields and many structural components.",Active,For Profit,,,1956-01-01,year,"Aerospace, Industrial, Machinery Manufacturing, Manufacturing"
Akron-Canton Airport,https://www.crunchbase.com/organization/akron-canton-airport,"Canton, Ohio, United States",,Active,For Profit,,,1946-02-01,day,"Aerospace, Air Transportation, Transportation"
Precision Aerospace Products,https://www.crunchbase.com/organization/precision-aerospace-products,"Bellevue, Washington, United States","Precision Aerospace Products is a holding entity for diverse businesses in the aerospace and defence industries. Precision Aerospace Products provides category products and technical services along with guidance and expertise to enhance business opportunities globally, maintain cost efficiencies, and improve military aviation readiness. Precision Aerospace Products delivers results to global customers, employees, and stakeholders with decades of business success.",Active,For Profit,,,1945-01-01,year,"Aerospace, Logistics, Space Travel, Technical Support, Training"
Prospect Mold,https://www.crunchbase.com/organization/prospect-mold,"Cuyahoga Falls, Ohio, United States","Prospect Mold offers engineering, fabrication, and inspection of tooling and molds for the aerospace, automotive, and military industries. The company was founded in 1945 and is headquartered in Cuyahoga Falls, Ohio.",Active,For Profit,Private Equity,,1945-01-01,year,"Aerospace, Automotive, Manufacturing, Military"
National Air Filter,https://www.crunchbase.com/organization/national-air-filter,"Cedar Grove, New Jersey, United States","National Air Filter is the oldest and largest full-service Air Filtration Management Company in the United States, proudly serving the Pharmaceutical, Biotech, Healthcare, Medical Research, Power Generation, and Commercial Real Estate Industries since 1939. National Air Filter is a medium-sized, privately-held company with headquarters and warehouses in Cedar Grove, New Jersey. Our customers are primarily located in the eastern U.S., from Massachusetts to Maryland.",Active,For Profit,,,1939-01-01,year,"Air Transportation, Building Maintenance, Manufacturing, Test and Measurement"
Allied Pilots Association,https://www.crunchbase.com/organization/allied-pilots-association,"Fort Worth, Texas, United States",,Active,For Profit,,,1963-01-01,year,"Aerospace, Association"
Dicronite,https://www.crunchbase.com/organization/dicronite,"Nampa, Idaho, United States",,Active,For Profit,,,1965-01-01,year,"Aerospace, Manufacturing, Medical Device"
Burlington International Airport,https://www.crunchbase.com/organization/burlington-international-airport,"Burlington, Vermont, United States","Burlington International Airport has rental cars, restaurants, and shops. Their rental car companies are all conveniently located inside the terminal, on the main floor, adjacent to the baggage carousels. Their shops offer travellers books, magazines, snacks, drinks, and a wide assortment of specialty foods.",Active,For Profit,,,1920-01-01,year,"Aerospace, Air Transportation, Transportation"
Goodyear Aerospace,https://www.crunchbase.com/organization/goodyear-aerospace,"Akron, Ohio, United States","The founding date for Goodyear Aerospace Corporation was listed here on www.crunchbase.com  as 1987.  I knew this was incorrect because my father, Robert C. Nelson,  worked for Goodyear Aerospace Corporation, a subsidiary of Goodyear Tire and Rubber Company.  Our family moved from Detroit, Michigan where Dad's work had to do with tires for automobiles to the Los Angeles area where his new job at Goodyear was in aerospace.   We moved the summer of 1957.  I remember celebrating my June birthday at a motel in Los Angeles where we lived temporarily until our new home was built and ready later that summer.  I read on Wikipedia that the Goodyear Zeppelin Corp. built rigid airships in conjunction with Germany until the relationship between the U.S. and Germany deteriorated prior to World War II.  So in 1939 the Goodyear Aircraft Company dissociated itself from Germany and became its own entity.  In the post-World War II era as Goodyear Aircraft Company's products diversified, especially in terms of radar systems, it became the Goodyear Aerospace Corporation in 1963.",Active,For Profit,,,1924-01-01,year,Aerospace
General Products Partners,https://www.crunchbase.com/organization/general-products-partners,"Brownsboro, Alabama, United States",,Active,For Profit,,,1948-01-01,year,"Aerospace, Industrial Engineering, Manufacturing"
Superior Motion Control,https://www.crunchbase.com/organization/superior-motion-control,"Farmingdale, New York, United States",,Active,For Profit,,,1963-01-01,year,"Aerospace, Industrial Manufacturing, Manufacturing, Military"
Cascade Gasket & Manufacturing,https://www.crunchbase.com/organization/cascade-gasket-manufacturing,"Auburn, Washington, United States",,Active,For Profit,,,1946-01-01,year,"Aerospace, Industrial Engineering, Manufacturing"
Louis Armstrong New Orleans International Airport,https://www.crunchbase.com/organization/louis-armstrong-new-orleans-international-airport,"Kenner, Louisiana, United States",Louis Armstrong New Orleans International Airport provides a passenger-friendly environment that welcomes millions of travelers each year from around the world.,Active,For Profit,,,1946-05-01,month,Air Transportation
Gar-Kenyon Technologies,https://www.crunchbase.com/organization/gar-kenyon-technologies,"Meriden, Connecticut, United States",,Active,For Profit,,,1950-01-01,day,"Aerospace, Hardware, Manufacturing"
GSP International Airport,https://www.crunchbase.com/organization/gsp-international-airport,"Greer, South Carolina, United States",,Active,For Profit,,,1962-01-01,year,"Air Transportation, Government, Public Transportation, Transportation"
Thomson Lamination company,https://www.crunchbase.com/organization/thomson-lamination,"Maple Shade, New Jersey, United States","Thomson Lamination developed into a fully integrated company producing precision carbide dies, laminations made from a wide range of electrical steel alloys, annealing of magnetic materials, and entire electric motor subassemblies, including rotors and engine components. Laminations for essential applications in the military, aerospace, medical, machine tool, and energy sectors,  other technically demanding markets.",Active,For Profit,,,1964-01-01,year,"Aerospace, Manufacturing, Medical, Military, Service Industry"
New England Propeller Service,https://www.crunchbase.com/organization/new-england-propeller-service,"East Haddam, Connecticut, United States","New England Propeller Service provides buying, selling, exchanging, and servicing propellers. They offer inquiries through phone calls and emails.",Active,For Profit,,,1955-01-01,year,"Aerospace, Air Transportation, Sales, Technical Support"
National Utilities,https://www.crunchbase.com/organization/national-utilities,"Fort Worth, Texas, United States",,Active,For Profit,,,1950-01-01,year,"Aerospace, Industrial, Manufacturing"
Mears Machine Corporation,https://www.crunchbase.com/organization/mears-machine-corporation,"Avon, Indiana, United States",,Active,For Profit,,,1966-01-01,year,"Aerospace, Machinery Manufacturing, Manufacturing"
Unit Industries Group,https://www.crunchbase.com/organization/unit-industries-group,"Santa Ana, California, United States",,Active,For Profit,,,1963-01-01,year,"Aerospace, Electronics, Manufacturing"
Laminated Shim,https://www.crunchbase.com/organization/laminated-shim,"Corona, California, United States","Laminated Shim is a sheet metal contractor manufacturing standardized automotive rod shims used by mechanics to maintain wheel alignment in the early automobile era. They provide aluminum, stainless steel, brass, titanium, waterjet, and metal stampings. They offer a laminating process that enables us to meet and or exceed the created industry-required standards.",Active,For Profit,,,1913-01-01,year,"Aerospace, Industrial, Manufacturing"
Ryan Air,https://www.crunchbase.com/organization/ryan-air,"Anchorage, Alaska, United States",,Active,For Profit,,,1953-01-01,year,"Air Transportation, Freight Service, Public Transportation, Transportation"
B&E Group,https://www.crunchbase.com/organization/b-e-group,"Southwick, Massachusetts, United States","B&E Group functions to provide engine and aircraft systems component overhaul and repair services for airlines around the world. B&E Precision Aircraft Components is an industry leader in precision aerospace manufacturing. They specialize in precision manufacturing, heat treatment, brazing, and non-destructive testing. They manufacture complex, machined components used in commercial aerospace, military and space applications, and a maintenance, repair and overhaul which repairs commercial aerospace engine components.",Active,For Profit,,,1950-01-01,year,"Aerospace, Manufacturing, Service Industry"
Lockheed Martin,https://www.crunchbase.com/organization/lockheed-martin-3200,"Bethesda, Maryland, United States",,Active,For Profit,,,1911-01-01,year,"Aerospace, Employment, Manufacturing, Space Travel"
"LaFarge & Egge, Inc.",https://www.crunchbase.com/organization/lafarge-egge-inc,"Lynnwood, Washington, United States",,Active,For Profit,,,1962-01-01,year,"Aerospace, Automotive, Industrial, Industrial Engineering, Industrial Manufacturing, Manufacturing"
Jacon,https://www.crunchbase.com/organization/jacon,"Chatsworth, California, United States",,Active,For Profit,,,1956-01-01,day,"Aerospace, Electronics, Industrial"
North East Fasteners,https://www.crunchbase.com/organization/north-east-fasteners,"Terryville, Connecticut, United States",,Active,For Profit,,,1963-01-01,year,"Aerospace, Automotive, Commercial, Manufacturing, Military"
Woodland Aviation,https://www.crunchbase.com/organization/woodland-aviation,"Davis, California, United States","Woodland Aviation offers aircraft sales, brokerage, and parts. They provide repair stations and authorized service centers for beechcraft, diamond aircraft, cirrus, and cessna. They also offer panel upgrades, database, and software services.",Active,For Profit,,,1963-01-01,year,"Aerospace, Customer Service, Sales"
Allan Aircraft,https://www.crunchbase.com/organization/allan-aircraft,"North Hollywood, California, United States","Allan Aircraft operates as a manufacturer of hydraulic fittings since 1952. They manufacture and stock a wide range of aerospace standards, commercial and industrial fittings. Their manufacturing, production and sales team also work to customer designed fittings and will offer a competitive quote.",Active,For Profit,,,1952-01-01,year,"Aerospace, Air Transportation, Manufacturing"
Rhinestahl,https://www.crunchbase.com/organization/rhinestahl,"Mason, Ohio, United States",,Active,For Profit,,,1967-01-01,year,"Aerospace, Electronics, Manufacturing, Mechanical Engineering"
Compressed Gas Systems,https://www.crunchbase.com/organization/compressed-gas-systems,"Los Alamitos, California, United States",,Active,For Profit,,,1948-01-01,year,"Aerospace, Service Industry, Small and Medium Businesses"
Port Freeport,https://www.crunchbase.com/organization/port-freeport,"Freeport, Texas, United States","Port Freeport provides project cargo and breakbulk operations, container operations, heavy lift terminals, roll-on and off operations, and foreign trade zone services.",Active,For Profit,,,1925-01-01,year,"Air Transportation, Freight Service, Logistics, Transportation"
J.A. Air Center,https://www.crunchbase.com/organization/j-a-air-center,"Sugar Grove, Illinois, United States","J.A. Air Center is a company that provides a premier one-stop shop for general aviation customers. The J.A Air Center was founded to offer dealership-caliber service to aircraft. They are specializing in Avionics Installation, Aircraft Maintenance, FBO Services, Hangar Rental, Aircraft Detailing, Aircraft Interiors, Aircraft Parts, Aircraft Sales, Flight Training, Aircraft Charter, and Pilot Supplies.",Active,For Profit,,,1965-01-01,year,"Aerospace, Air Transportation, Professional Services, Transportation"
S & L Aerospace Metals,https://www.crunchbase.com/organization/s-l-aerospace-metals,"Flushing, New York, United States",,Active,For Profit,,,1967-01-01,year,"Aerospace, Commercial, Manufacturing, Mechanical Engineering, Supply Chain Management"
JD Ott,https://www.crunchbase.com/organization/jd-ott,"Seattle, Washington, United States",,Active,For Profit,,,1943-01-01,year,"Aerospace, Industrial, Manufacturing"
Notthoff Engineering,https://www.crunchbase.com/organization/notthoff-engineering,"Huntington Beach, California, United States",Notthoff Engineering provides aerospace components. They provide engineering solutions by using cutting-edge technology and machinery. They provide machining services. They provide assembly solutions for aerostructures companies. They provide inquiries through online applications and phone calls.,Active,For Profit,,,1941-01-01,year,"Aerospace, Machinery Manufacturing, Manufacturing, Product Design"
Budney Industries,https://www.crunchbase.com/organization/budney-industries,"Berlin, Connecticut, United States","Budney Industries produces a variety of engine parts, both for aerospace and ground-based engines. Their full-service shop specializes in turning large parts for major rotating parts, while also manufacturing static and ancillary parts. Budney is synonymous with quality, service, and innovative solutions for aircraft engine components since 1940. There is no shortage of shops that can cut metal. Budney Industries combines the best aspects of aircraft engine manufacturing with the flexibility of a job shop to deliver high-quality parts on time. A combination of skilled machinists and computerized numerical control (CNC) allows Budney Industries to produce complex and precise parts from even the toughest alloys. Production runs are handled with cellular manufacturing and kaizen, while prototyping, tooling, and experimental production are handled with traditional machinist skills. Their situation is ideal! The company's turning equipment can handle parts up to 72"" diameter [1828mm] and 125"" long [3175mm]. They use twin-turret CNC lathes for simul-turn machining that can be cost-effective.",Active,For Profit,,,1940-01-01,year,"Aerospace, Automotive, Industrial, Manufacturing, Mechanical Engineering"
Aerator Solutions,https://www.crunchbase.com/organization/aerator-solutions,"Roscoe, Illinois, United States","Aerator Solutions is a provider of aerators and mixers for industrial and municipal wastewater treatment operations. They make aerators and mixers. Most recently, they have introduced a game-changing system that’s revolutionizing the wastewater aeration industry, the EcoDome™ aeration system is a hyperbaric dome that is a true gas-to-liquid interface. That advanced system offers preeminent efficiencies, greater energy savings and meaningful ROI. Recognized worldwide for their service and expertise in wastewater treatment, Aerator Solutions is the sought-out resource for industrial and municipal wastewater treatment equipment expertise. They assist in design, planning, and implementation of our EcoJet™ products to meet your process requirements.",Active,For Profit,,,1962-01-01,year,"Aerospace, Water Purification"
Tech-Tool Plastics,https://www.crunchbase.com/organization/tech-tool-plastics,"Fort Worth, Texas, United States",,Active,For Profit,,,1965-01-01,year,"Aerospace, Industrial, Manufacturing, Mechanical Design, Mechanical Engineering"
Zephyr Tool Group,https://www.crunchbase.com/organization/zephyr-tool-group,"Inglewood, California, United States",,Active,For Profit,,,1939-01-01,year,"Aerospace, Industrial, Machinery Manufacturing, Manufacturing"
Abbott Technologies,https://www.crunchbase.com/organization/abbott-technologies,"Sun Valley, California, United States",,Active,For Profit,,,1961-01-01,year,"Aerospace, Electronics, Industrial, Manufacturing"
Masters Machine Company,https://www.crunchbase.com/organization/masters-machine-company,"Round Pond, Maine, United States","Masters Machine Company manufactures and supplies precision components to medical, automotive, and electronics industries it is a precision machine shop. That has produced precision turned and milled components for the defense, aerospace, automotive, electronics and commercial industries.",Active,For Profit,,,1957-01-01,year,"Aerospace, Automotive, Electronics, Industrial Manufacturing, Machinery Manufacturing, Manufacturing"
TPS Aviation,https://www.crunchbase.com/organization/tps-aviation,"Hayward, California, United States",,Active,For Profit,,,1961-01-01,year,"Aerospace, Logistics, Wholesale"
Pervan Industries,https://www.crunchbase.com/organization/pervan-industries,"Rancho Dominguez, California, United States","Pervan Industries is a leader in aerospace sheet metal, hydroforming, CNC punching, routing, brake forming, water jet cutting, machining, and assemblies. They offer fabricated parts and assemblies from aluminum, stainless steel, and titanium.",Active,For Profit,,,1955-01-01,year,"Aerospace, Delivery, Manufacturing"
Sealth Aero Marine,https://www.crunchbase.com/organization/sealth-aero-marine,"Mill Creek, West Virginia, United States","Sealth Aero Marine develops and manufactures precision latches, bolting systems, hinges, and other components. Their products are widely employed in a variety of industries, including aerospace, defense, marine, and space applications. Sealth Aero Marine products are available with a wide range of ornamental treatments and coatings.",Active,For Profit,,,1959-01-01,year,"Aerospace, Industrial, Machinery Manufacturing, Manufacturing"
AMETEK PDS,https://www.crunchbase.com/organization/ametek-pds,"Harleysville, Pennsylvania, United States","AMETEK PDS distributes components and systems for aviation and military sectors. Their products includes power generation, power distribution, utility controllers, electric motors, actuators, data acquisition units, indicators, panels, fans, and blowers. They offers customer support through phone contact.",Active,For Profit,,,1967-01-01,year,"Aerospace, Consumer Goods, Military, Wholesale"
"Carson Helicopters, Inc.",https://www.crunchbase.com/organization/carson-helicopters-inc,"Perkasie, Pennsylvania, United States",,Active,For Profit,,,1958-01-01,year,"Aerospace, Manufacturing"
United Tool & Die,https://www.crunchbase.com/organization/united-tool-die,"West Hartford, Connecticut, United States","United Tool & Die functions as a diverse tube, duct, and sheet metal fabrication job shop In business since 1923. They strive to maintain stability with growing world technology by providing the highest quality product at the lowest total cost.",Active,For Profit,,,1923-01-01,year,"3D Printing, Aerospace, Chemical"
H. Galow Co,https://www.crunchbase.com/organization/h-galow-co,"Norwood, New Jersey, United States",,Active,For Profit,,,1961-01-01,year,"Aerospace, Manufacturing, Mechanical Engineering"
Marion Mold & Tool,https://www.crunchbase.com/organization/marion-mold-tool,"Marion, Virginia, United States",,Active,For Profit,,,1957-01-01,year,"Aerospace, Industrial Engineering, Manufacturing"
MUELLER,https://www.crunchbase.com/organization/mueller-5874,"Charlotte, North Carolina, United States",,Active,For Profit,,,1940-01-01,day,"Aerospace, Industrial, Manufacturing"
DeVore Aviation Corporation of America,https://www.crunchbase.com/organization/devore-aviation-corporation-of-america,"Albuquerque, New Mexico, United States",,Active,For Profit,,,1954-01-01,year,"Aerospace, Lighting, Mechanical Engineering, Software"
South Bend Controls,https://www.crunchbase.com/organization/south-bend-controls,"South Bend, Indiana, United States","South Bend Controls, Inc. designs, develops, and manufactures fluid control components for medical, aerospace, space, and industrial markets worldwide. It offers two and three way solenoid valves, anti-ice valves, check valves, fill and vent valves, integrated systems, and quick disconnect couplings. The company also provides regulators, relief valves, proportional flow control valves, squib valves, and thrust valves, as well as inert isolation and proportional valves. Its products are used in hydraulic, pneumatic, and fuel systems.",Active,For Profit,,,1940-01-01,year,"Aerospace, Machinery Manufacturing, Manufacturing"
Causey Aviation Service,https://www.crunchbase.com/organization/causey-aviation-service,"Liberty, Missouri, United States","Causey Aviation Service secure, private, on-demand jet transportation in the u.s., europe, canada, mexico, central america, bermuda and the caribbean. causey aviation service strives to provide a consistent, reliable travel experience to our clients time after time. incorporated in 1967, causey aviation has provided a full range of aviation services for over 40 years. causey aviation offers aircraft management with a complete array of services including charter, scheduling, dispatch, crew, maintenance, faa compliance, facilities and ground handling.",Active,For Profit,,,1967-01-01,year,"Aerospace, Air Transportation, Facilities Support Services, Transportation"
LA Aluminum Casting Company,https://www.crunchbase.com/organization/la-aluminum-casting-company,"Hayden, Idaho, United States","LA Aluminum Casting Company provides mold aluminum castings for commercial, dental, aerospace, and military industries. They offer machining, engineering, tool building, and powder coating. Their customers contact through email, phone, and online applications.",Active,For Profit,,,1947-01-01,year,"Aerospace, Automotive, Commercial, Dental, Manufacturing, Military"
