Courtney Aviation,https://www.crunchbase.com/organization/courtney-aviation,"Columbia, California, United States","Courtney Aviation offers services like air attack, infrared intelligence, data link network, pro avionics,aircraft fleet, and aircraft maintenance.  For inquiries, telephone and email contacts are used.",Active,For Profit,,,1967-01-01,year,"Aerospace, Air Transportation, Training"
Ventura,https://www.crunchbase.com/organization/ventura-5aef,"Farmingdale, New York, United States",,Active,For Profit,,,1955-01-01,year,"Air Transportation, Commercial, Logistics"
George Products,https://www.crunchbase.com/organization/george-products,"Middletown, Delaware, United States","George Products is a company that specializes in precision metal manufacturing. In addition to bespoke fabrication services, George Products is a full-service metal product fabrication company that manufactures the OASIS Inspection System. The OASIS is a full-featured machine vision inspection system developed to accurately measure various profile dimensions of small objects.",Active,For Profit,,,1950-01-01,year,"Aerospace, Industrial Manufacturing, Manufacturing, Mechanical Engineering, Sales"
McCreery Aviation Company,https://www.crunchbase.com/organization/mccreery-aviation-company,"Mcallen, Texas, United States","McCreery Aviation Company provides a pilot lounge, a pilot quiet room, an office available for day use, shower facilities, big screen HD televisions, computers with high-speed internet access, wireless internet, a comfortable passenger lobby, a conference room, a pilot supply store, a flight planning room, a large concrete ramp, and restaurants within walking distance of the airport.",Active,For Profit,,,1946-01-01,year,"Aerospace, Air Transportation, Service Industry"
Desser Aerospace,https://www.crunchbase.com/organization/desser-aerospace,"Montebello, California, United States",,Active,For Profit,,,1920-01-01,year,"Aerospace, Manufacturing, Supply Chain Management"
Space-Lok,https://www.crunchbase.com/organization/space-lok,"Gardena, California, United States",,Active,For Profit,,,1962-01-01,year,"Aerospace, Industrial, Manufacturing"
Dothan Regional Airport,https://www.crunchbase.com/organization/dothan-regional-airport,"Dothan, Alabama, United States","Dothan Regional Airport offers jet services. They provide electronic kiosks for easy check-in and baggage care, an ATM, delicious home cooking at the dinner bell café, and comfortable seating. Additionally, the airport includes a business center, car rental agencies, and a gift shop.",Active,For Profit,,,1962-01-01,year,"Air Transportation, Public Transportation, Travel"
Spincraft Company,https://www.crunchbase.com/organization/spincraft-company,"North Billerica, Massachusetts, United States","Spincraft is a Standex Engineering Technologies Group company. Spincraft delivers integrated, single-source manufacturing solutions for complex fabrications and assemblies of every scope",Active,For Profit,,,1918-01-01,year,"Aerospace, Farming, Manufacturing"
Bald Eagle Flying Club,https://www.crunchbase.com/organization/bald-eagle-flying-club,"Portland, Maine, United States",Bald Eagle Flying Club is a airlines and aviation club that offers pilots course and certifications services. They provides customer support through email.,Active,For Profit,,,1956-01-01,year,"Aerospace, Communities, Training"
SMC Aerospace,https://www.crunchbase.com/organization/smc-aerospace,"Seabrook, New Hampshire, United States","SMC Aerospace provides CNC machining, tube bending, tube fabrication, welding and brazing, reverse engineering services.",Active,For Profit,,,1961-01-01,day,"Aerospace, Machinery Manufacturing, Manufacturing"
Harris Acoustic Products,https://www.crunchbase.com/organization/harris-acoustic-products,"East Walpole, Massachusetts, United States","Harris specialises in the design, supply and support of submarine acoustic transducers and arrays. The transducers create the acoustic pulse, or ‘sonar ping’, in the water and receive the resulting echo return from potential targets. Multiple transducers are assembled by Harris into arrays to allow higher power acoustic pings and an improved directional capability of the sonar system.",Active,For Profit,,,1951-01-01,year,"Aerospace, Electronics"
Krause Airco,https://www.crunchbase.com/organization/krause-airco,"Santa Paula, California, United States",,Active,For Profit,,,1942-01-01,year,"Aerospace, Industrial Manufacturing, Manufacturing"
Port of Moses Lake,https://www.crunchbase.com/organization/port-of-moses-lake,"Moses Lake, Washington, United States",,Active,For Profit,,,1965-01-01,year,"Aerospace, Information Technology, Manufacturing, Transportation"
ES Electronics,https://www.crunchbase.com/organization/es-electronics,"Simi Valley, California, United States",,Active,For Profit,,,1957-01-01,day,"Aerospace, Customer Service, Electronics"
Valley International Airport,https://www.crunchbase.com/organization/valley-international-airport,"Harlingen, Texas, United States","Valley International Airport is the home to Southwest Airlines and Continental and major cargo operators such as DHL, FedEx, and UPS. It is a CAT II airport with about 500,000 enplanements a year, is located in the Rio Grande Valley of Texas. It has the longest runways in the region and is designated as a primary diversion airport for major air carriers.",Active,For Profit,,,1941-01-01,year,"Aerospace, Air Transportation, Public Transportation, Transportation"
Nelson Manufacturing,https://www.crunchbase.com/organization/nelson-manufacturing,"Ottawa, Ohio, United States","Nelson Manufacturing Company designs and builds custom semi-trailers for various industries.  They specialize in transporting heavy hauls and sensitive cargoes.  The company sells trailers that can hold up to 200 tons.  Trailers made by their company are used in areas such as aerospace, construction, nuclear, and mobile equipment.  Their product line also includes boom launch trailers, pin 'n gos, boom dollies, and more for transporting hydraulic cranes.  Regardless of your project, they will provide you with a custom transportation solution.",Active,For Profit,,,1947-01-01,year,"Aerospace, Manufacturing, Public Transportation, Transportation, Travel"
Bertrand Products,https://www.crunchbase.com/organization/bertrand-products,"South Bend, Indiana, United States",,Active,For Profit,,,1953-01-01,year,"Aerospace, Industrial Engineering, Manufacturing"
Falls Filtration Technologies,https://www.crunchbase.com/organization/falls-filtration-technologies,"Stow, Ohio, United States","Falls Filtration Technologies designs and produces filtration products for the aircraft, agricultural, railroad, construction, trucking, and power industries, just to name a few. Typical applications include gasoline and diesel engines, generators, air and gas compressors, commercial and light aircraft, vacuum pumps, pressure blowers, and locomotives. Falls Filtration supports its markets and customers worldwide.",Active,For Profit,,,1927-01-01,year,"Aerospace, Industrial, Manufacturing"
Atlantic Research Corp,https://www.crunchbase.com/organization/atlantic-research-corp,"Gainesville, Virginia, United States","Atlantic Research develops and manufactures solid propellant rocket motors, gas generators, composite materials.",Active,For Profit,,,1949-01-01,year,Aerospace
Farwest Aircraft,https://www.crunchbase.com/organization/farwest-aircraft,"Wausau, Wisconsin, United States","Farwest Aircraft functions as a manufacturer and supplier of ground support equipment, aircraft maintenance tooling and electrical test equipment in 1967. It is a leading company in the aviation industry for more than half a century. They support Aircraft Maintenance worldwide by providing superior products at the highest return on investment.",Active,For Profit,,,1967-01-01,year,"Aerospace, Air Transportation, Customer Service, Manufacturing"
Ceco,https://www.crunchbase.com/organization/ceco,"Wichita, Kansas, United States",,Active,For Profit,,,1937-01-01,year,"Aerospace, Air Transportation, Manufacturing"
Van Nuys Airport,https://www.crunchbase.com/organization/van-nuys-airport,"Van Nuys, California, United States",,Active,For Profit,,,1928-01-01,year,"Aerospace, Air Transportation, Travel"
Cee-Bee,https://www.crunchbase.com/organization/cee-bee,"Cleveland, Ohio, United States",,Active,For Profit,,,1927-01-01,year,"Aerospace, Chemical Engineering, Industrial Engineering, Manufacturing"
Snowline Aerospace,https://www.crunchbase.com/organization/snowline-aerospace,"Shingle Springs, California, United States",,Active,For Profit,,,1966-01-01,year,"Aerospace, Industrial Engineering, Manufacturing, Technical Support"
S&H Machine,https://www.crunchbase.com/organization/s-h-machine,"Burbank, California, United States",,Active,For Profit,,,1960-01-01,year,"Aerospace, Manufacturing, Professional Services, Transportation"
Consolidated Aircraft Supply,https://www.crunchbase.com/organization/consolidated-aircraft-supply,"Ronkonkoma, New York, United States",,Active,For Profit,,,1960-01-01,year,"Aerospace, Industrial, Manufacturing, Service Industry"
Photo Etch,https://www.crunchbase.com/organization/photo-etch,"Fort Worth, Texas, United States","Airco Industries, Inc., doing business as Photo Etch, designs and manufactures illuminated display and control panels, simulation systems, and electronic assemblies for land and sea-based systems, commercial, and military applications in aerospace and defense industry the United States and internationally. The company specializes in night vision imaging systems.",Active,For Profit,,,1960-01-01,year,"Aerospace, Manufacturing"
Nielsen Engineering & Research,https://www.crunchbase.com/organization/nielsen-engineering-research,"Santa Clara, California, United States",,Active,For Profit,,,1966-01-01,year,"Aerospace, Product Design"
Minuteman Aviation,https://www.crunchbase.com/organization/minuteman-aviation,"Missoula, Montana, United States",,Active,For Profit,,,1960-01-01,year,"Aerospace, Mechanical Engineering, Technical Support"
General Broach Company,https://www.crunchbase.com/organization/general-broach-company,"Morenci, Michigan, United States",,Active,For Profit,,,1942-01-01,year,"Aerospace, Automotive, Machinery Manufacturing, Manufacturing"
Component Products,https://www.crunchbase.com/organization/component-products,"Mukilteo, Washington, United States",,Active,For Profit,,,1967-01-01,year,"Aerospace, Manufacturing, Military, Wholesale"
Des Moines Flying Service,https://www.crunchbase.com/organization/des-moines-flying-service,"Des Moines, Iowa, United States","Des Moines Flying Service manufactures and sells aircraft parts and services, upgrades, trades, and locates them.  Their services include aircraft maintenance, extensive parts inventory, and technical services. They offers customer support through phone contact.",Active,For Profit,,,1939-01-01,year,"Aerospace, Manufacturing, Sales, Service Industry"
Crestview Aerospace Corporation,https://www.crunchbase.com/organization/crestview-aerospace-corporation,"Crestview, Florida, United States",,Active,For Profit,,,1964-01-01,year,Aerospace
Associated Industries,https://www.crunchbase.com/organization/associated-industries,"Wichita, Kansas, United States","Associated Industries is an established supplier with over 60 years of business success. They strive to offer the best products, customer service and technical expertise possible to support or customers.",Active,For Profit,,,1952-01-01,year,"Advanced Materials, Aerospace, Industrial Engineering"
North American Helicopter,https://www.crunchbase.com/organization/north-american-helicopter,"Mascoutah, Illinois, United States","North American Helicopter offer operational services, aerial firefighting, utility inspection, charter flights, scenic tours, helicopter emergency response, and aerial photography. They provide luxury helicopters for major events, group incentives and special occasions.",Active,For Profit,,,1967-01-01,year,"Aerospace, Air Transportation, Travel"
Rainier Heli International,https://www.crunchbase.com/organization/rainier-heli-international,"Kirkland, Washington, United States","Rainier Heli International is a helicopter business. They specialize in providing lease programs to meet specific needs. They offer heavy lift work with our KMAX helicopters, which we have been operating accident-free. Its hot and high performance is nothing short of exceptional, and it has the quietest sound signature of any heavy lift helicopter.",Active,For Profit,,,1965-01-01,year,"Aerospace, Leasing, Retail"
Precision Manufacturing Solutions,https://www.crunchbase.com/organization/precision-manufacturing-solutions-212d,"Saco, Maine, United States","Precision Manufacturing Solutions is an engineering and contract manufacturing center that produces critical components and assemblies for the aerospace, defense, industrial, and medical markets.",Active,For Profit,,,1962-01-01,year,"Aerospace, Industrial, Manufacturing"
The Travel Station,https://www.crunchbase.com/organization/the-travel-station,"Bozeman, Montana, United States","The Travel Station offers corporate, group, air, and ground travel services. They provide corporations with professional travel services. They offer travel agents and appointment booking reservation services. If anyone wants to contact them please contact them via phone call or email.",Active,For Profit,,,1917-01-01,year,"Air Transportation, Reservations, Tourism, Travel"
Ralmark Company,https://www.crunchbase.com/organization/ralmark-company,"Kingston, Pennsylvania, United States",,Active,For Profit,,,1964-01-01,year,"Aerospace, Industrial Manufacturing, Machinery Manufacturing, Manufacturing"
Alturair,https://www.crunchbase.com/organization/alturair,"El Cajon, California, United States","Alturair provides alignment and assembly services that can save the builder hours of work while ensuring levels of quality, safety, and performance. They also offer a line of custom parts, hardware, and plans. For inquiries, telephone and email contact are used.",Active,For Profit,,,1967-01-01,year,"Aerospace, Hardware, Manufacturing"
Texas Aerospace Services,https://www.crunchbase.com/organization/texas-aerospace-services,"Abilene, Texas, United States",,Active,For Profit,,,1967-01-01,year,"Air Transportation, Quality Assurance, Transportation"
Transland,https://www.crunchbase.com/organization/transland-14b2,"Wichita Falls, Texas, United States",,Active,For Profit,,,1945-01-01,year,"Air Transportation, Machinery Manufacturing, Manufacturing, Product Design"
O&W Heat Treat,https://www.crunchbase.com/organization/o-w-heat-treat,"South Windsor, Connecticut, United States","O&W Heat Treat provides heat treating, bright hardening, tempering, solution treating, precipitation hardening, age hardening, dry and wet hydrogen annealing, annealing, and stress-relieving services. They offer services for the nuclear, medical, automotive, petroleum, and computer hardware industries.",Active,For Profit,,,1964-01-01,year,"Aerospace, Industrial, Test and Measurement"
Continental Heat Treating,https://www.crunchbase.com/organization/continental-heat-treating,"Santa Fe Springs, California, United States","Continental Heat Treating focuses on the heat treatment and casehardening of alloy and stainless steel. Processing capabilities include vacuum and atmosphere neutral heat treating, nitride, carburize, and carbon-nitride case hardening; and precipitation hardening. Their processes include alloy steel, copper alloys, nickel alloys, stainless steel, and more.",Active,For Profit,,,1957-01-01,year,"Aerospace, Chemical, Commercial, Industrial, Manufacturing"
Truckee Tahoe Airport,https://www.crunchbase.com/organization/truckee-tahoe-airport,"Truckee, California, United States",,Active,For Profit,,,1958-01-01,year,Aerospace
Air Parts & Supply Company,https://www.crunchbase.com/organization/air-parts-supply-company,"Miami, Florida, United States","Air Parts & Supply Company, Inc. distributes aircraft ignition and fuel control parts to the aerospace industry.",Active,For Profit,Venture - Series Unknown,,1959-01-01,year,"Aerospace, Retail"
Rose Aircraft Services,https://www.crunchbase.com/organization/rose-aircraft-services,"Mena, Arkansas, United States",,Active,For Profit,,,1964-01-01,year,"Aerospace, Interior Design, Service Industry"
Automatic Anodizing,https://www.crunchbase.com/organization/automatic-anodizing,"Chicago, Illinois, United States","Automatic Anodizing provides chemical conversion coating services, chromate conversion coating services, and type ii anodization services. They support and help fund important research aimed at finding a cure for breast cancer.",Active,For Profit,,,1947-01-01,year,"Air Transportation, Industrial, Transportation"
Riggin Flight Service,https://www.crunchbase.com/organization/riggin-flight-service,"Madison, South Dakota, United States","Riggin Flight Service provides aviation and flight training services. They provide a designated pilot examiner, a remote pilot examiner, a psi testing center, mechanic services, pilot services, and Sorensen spray systems. The company's contact modes are by mail, phone, and physical address.",Active,For Profit,,,1947-01-01,year,"Aerospace, Training, Transportation"
Omaha Airplane Supply,https://www.crunchbase.com/organization/omaha-airplane-supply,"Omaha, Nebraska, United States",,Active,For Profit,,,1963-01-01,day,Aerospace
Accurate Welding Services,https://www.crunchbase.com/organization/accurate-welding-services,"Windsor Locks, Connecticut, United States","Accurate Welding Services offers electron beam welding machines, gtaw, tig welders, calibration and inspection, excello milling machines, 1 8-inch lathe, 1 band saw, 2 belt sanders, 3 grinders, buffing machines, 2 drill presses, and 1 48-inch brake.",Active,For Profit,,,1967-01-01,month,"Aerospace, Mechanical Engineering, Service Industry"
Western Helicopters,https://www.crunchbase.com/organization/western-helicopters,"Riverside, California, United States",,Active,For Profit,,,1964-01-01,year,"Air Transportation, Corporate Training, Training"
Del Monte Aviation,https://www.crunchbase.com/organization/del-monte-aviation,"Monterey, California, United States","Del Monte Aviation team professionals offers suite of amenities and services for cabin crew, passengers, and aircraft. If you want any information please contact them via phone call or email.",Active,For Profit,,,1946-01-01,year,"Aerospace, Customer Service, Sustainability"
McGhee Tyson Airport,https://www.crunchbase.com/organization/mcghee-tyson-airport,"Alcoa, Tennessee, United States","McGhee Tyson Airport offers flights from multiple airline carriers to many popular global destinations. They provide fuel and services to commercial carriers, corporate aviation, charter flights, flight schools and people who fly for hobby.",Active,For Profit,,,1937-01-01,year,"Air Transportation, Freight Service, Transportation"
Rettig Machine,https://www.crunchbase.com/organization/rettig-machine,"Redlands, California, United States","Rettig Machine has worked for customers in industries including aerospace, construction, mining, railroads, and steel and aluminum processing. Their expertise lies in custom, one-of-a-kind, medium-to-heavy machining and fabrication work. They have made everything from parts for coating machines for the metal processing industry.",Active,For Profit,,,1946-01-01,year,"Aerospace, Construction, Industrial, Manufacturing"
KTI,https://www.crunchbase.com/organization/kti-inc,"East Windsor, Connecticut, United States",,Active,For Profit,,,1966-01-01,year,Aerospace
Fresno Yosemite International,https://www.crunchbase.com/organization/fresno-yosemite-international,"Fresno, California, United States","Fresno is a community with an eye to providing something for everyone, and the means to enjoy all that can be found. Fresno Yosemite International Airport is home to major airlines grant one-stop flights to and from practically anywhere on the globe. Fresno Area Express networks passengers by bus in comfort and ease from east to west and north to south of the city. And information to pilot your own aircraft for business or leisure pursuits is just a link away with the excellent general aviation facilities Fresno Chandler Executive Airport provides. So come... and Discover Fresno! We are right here, and looking forward to meeting you so",Active,For Profit,,,1948-01-01,year,Air Transportation
Steel Tool and Engineering,https://www.crunchbase.com/organization/steel-tool-and-engineering,"Trenton, Michigan, United States",,Active,For Profit,,,1952-01-01,year,"Aerospace, Machinery Manufacturing, Manufacturing"
Port Of Shelton,https://www.crunchbase.com/organization/port-of-shelton,"Shelton, Washington, United States","At Port Of Shelton Sanderson Field is a general aviation airport and industrial park. This facility accommodates commercial, corporate, and recreational aircraft, as well as light industrial manufacturing, distribution and retail. Industrial park facility comprises of railroad access, 3-phase power, natural gas, potable water & fire flow, fiber optics and numerous flat buildable sites. These sites are largely unencumbered and are well suited for heavy manufacturing.",Active,For Profit,,,1948-01-01,year,"Air Transportation, Industrial, Manufacturing, Real Estate, Transportation"
Aero Component Engineering,https://www.crunchbase.com/organization/aero-component-engineering,"Valencia, California, United States",,Active,For Profit,,,1967-01-01,year,"Aerospace, Manufacturing, Mechanical Engineering"
Bozeman Yellowstone International Airport,https://www.crunchbase.com/organization/bozeman-yellowstone-international-airport,"Belgrade, Montana, United States",,Active,For Profit,,,1941-01-01,month,"Air Transportation, Public Transportation, Travel"
East Air Corporation,https://www.crunchbase.com/organization/east-air-corporation,"Hackensack, New Jersey, United States",,Active,For Profit,,,1950-01-01,year,"Aerospace, Management Consulting, Manufacturing"
Thompson Aluminum Casting Company,https://www.crunchbase.com/organization/thompson-aluminum-casting,"Cuyahoga Falls, Ohio, United States","Thompson Aluminum Casting Company is a casting supplier to the aerospace and defense industries. They provide all aluminum and magnesium protective coatings, as well as painting services. They follow government, military, and customer specifications to ensure castings are made according to specifications. Thompson Aluminum Casting Company is headquartered in Cuyahoga, Ohio and was founded in 1946.",Active,For Profit,,,1946-01-01,year,"Aerospace, Automotive, Chemical, Manufacturing, Military"
Bailey Hyd,https://www.crunchbase.com/organization/bailey-hyd,"Fort Worth, Texas, United States",,Active,For Profit,,,1962-01-01,year,"Aerospace, Warehousing, Wholesale"
Victory Ground Support Equipment,https://www.crunchbase.com/organization/victory-ground-support-equipment,"Los Angeles, California, United States",,Active,For Profit,,,1950-01-01,year,"Aerospace, Industrial, Manufacturing, Rental, Retail"
Shwayder,https://www.crunchbase.com/organization/shwayder,"Birmingham, Michigan, United States","Shwayder develops patented hyper, ultra-tough materials for a variety of applications. The surfacite helicopter skid shoes were created to address the issue of extreme wear on the skid shoes and skid tubes of military helicopters, particularly during pilot training exercises.",Active,For Profit,,,1951-01-01,year,"Aerospace, Manufacturing"
Western Abrasives,https://www.crunchbase.com/organization/western-abrasives,"Portland, Oregon, United States","Western Abrasives produces custom resin, hot pressed resin, rubber, and fiber abrasive products. They provide aerospace, foundry, stainless steel, mold and die, mounted points, abrasives, engineered, grinding, titanium, castings, Inconel, deburring, polishing, aerospace engines, metal work, iron works, cones and plugs, rubber bonded abrasives, resin mounted points, and vitrified mounted points.",Active,For Profit,,,1952-01-01,year,"Aerospace, Commercial, Industrial, Manufacturing"
Aero Structures Long Island,https://www.crunchbase.com/organization/aero-structures-long-island,"Westbury, New York, United States","Aero Structures Long Island produces precision-machined and monolithic structural components and assemblies for a variety of programs, including the military aircraft CH-47, V-22 Osprey, and F/A-18 Hornet fighters. Their commercial aircraft programs include the Airbus A330, Boeing 767 and 787, and Gulfstream G550 and G650.",Active,For Profit,,,1961-01-01,year,"Aerospace, Commercial, Manufacturing"
Cosgrove Aircraft Service,https://www.crunchbase.com/organization/cosgrove-aircraft-service,"Hauppauge, New York, United States",,Active,For Profit,,,1964-01-01,year,"Aerospace, Customer Service, Delivery Service"
Brico Engineering,https://www.crunchbase.com/organization/brico-engineering,"Torrance, California, United States",,Active,For Profit,,,1964-01-01,day,"Aerospace, Industrial, Manufacturing"
Dayton International Airport,https://www.crunchbase.com/organization/dayton-international-airport,"Dayton, Ohio, United States",,Active,For Profit,,,1936-01-01,year,"Aerospace, Air Transportation, Transportation, Travel"
SH&E,https://www.crunchbase.com/organization/sh-e,"New York, New York, United States","SH&E, the world’s largest consulting firm dedicated to air transport.",Active,For Profit,,,1963-01-01,year,"Aerospace, Consulting"
Delta Gear,https://www.crunchbase.com/organization/delta-gear,"Livonia, Michigan, United States",,Active,For Profit,,,1964-01-01,year,"Aerospace, Industrial, Manufacturing"
