Internet of Hardware,https://www.crunchbase.com/organization/internet-of-hardware,"Anaheim, California, United States","Browse our database for access to billions of new, used, and obsolete items. Owned and operated by ASAP Semiconductor, Internet of Hardware is a comprehensive parts procurement platform that combines ease of search with rapid lead times and responsive customer support to make the process effortless. In addition, our advanced information management capabilities allow customers to submit an instant RFQ all while browsing our database of trusted MROs, FBOs, airports, and more.",Active,For Profit,,,2021-10-10,day,Aerospace
Commonwealth Commuter Airways,https://www.crunchbase.com/organization/commonwealth-commuter-airways,"Worcester, Massachusetts, United States",,Active,For Profit,,,2021-01-01,year,"Aerospace, Air Transportation, Customer Service, Freight Service, Travel"
JACAL,https://www.crunchbase.com/organization/jacal,"Reno, Nevada, United States","JACAL supports the needs of commercial and DoD projects and services. They business sectors such as engineering and technology sectors of the business includes, aeronautical and aerospace engineering, fixed plane and rotorcraft data collection, cabin management and IFE systems, missile defense, and more.",Active,For Profit,,,2021-04-01,month,"Aerospace, Management Consulting, Military"
Inzed,https://www.crunchbase.com/organization/inzed,"Warner Robins, Georgia, United States",,Active,For Profit,,,2021-04-01,month,"Aerospace, Transportation"
Nomadic,https://www.crunchbase.com/organization/nomadic-04c1,"Dover, Delaware, United States","Nomadic conducts and completes aircraft acceptance profiles, lease return demonstrations, STC or certification flights, proving runs, post-PTF-conversion flight checks, and customer rep observation flights worldwide with a team consisting of highly experienced civilian and military-trained test-pilots.",Active,For Profit,,,2021-01-01,year,"Aerospace, Air Transportation, Commercial, Delivery"
SPACECO,https://www.crunchbase.com/organization/spaceco,"Ames, Iowa, United States",,Active,For Profit,,,2021-01-01,month,"Aerospace, Construction, Industrial"
PortaPilot,https://www.crunchbase.com/organization/portapilot,"Lake Forest Park, Washington, United States","PortaPilot provides aviation and aerospace components. They offer aircraft, power requirements, yoke extensions, and GPS devices, both panel mounted and portable. The company's contact modes are by mail, phone, and physical address.",Active,For Profit,,,2021-01-01,year,"Aerospace, Electronics, Retail"
WINGiT,https://www.crunchbase.com/organization/wingit-5b64,"Florida, New York, United States",,Active,For Profit,,,2021-01-01,month,"Aerospace, Mobile, Mobile Apps"
Ameriflight Components and Exchanges,https://www.crunchbase.com/organization/ameriflight-components-and-exchanges,"Dallas, Texas, United States",Ameriflight Components and Exchanges is a supplier of aircraft parts. They provide customers with reliable products on time and at an affordable price. They also offer tailor-made services within the supply chain.,Active,For Profit,,,2021-01-01,year,"Aerospace, Manufacturing, Supply Chain Management, Wholesale"
Aircraft Structures Group,https://www.crunchbase.com/organization/aircraft-structures-group,"Nashville, Tennessee, United States",,Active,For Profit,,,2021-01-01,year,"Aerospace, Industrial, Mechanical Engineering"
Aleutian Airways,https://www.crunchbase.com/organization/aleutian-airways,"Anchorage, Alaska, United States",,Active,For Profit,,,2021-01-01,year,"Air Transportation, Reservations, Travel Agency"
Rivas Aviation,https://www.crunchbase.com/organization/rivas-aviation,"Las Vegas, Nevada, United States","Rivas Aviation provides intermediate and advanced flight training, and aircraft acquisition services. They offer handle your aircraft acquisition requirements. Their service includes consultation and flight, flight training, personal support, and post-training support services.",Active,For Profit,,,2021-01-01,year,"Aerospace, Air Transportation, Consulting, Training"
Fly0kart,https://www.crunchbase.com/organization/fly0kart,"Hicksville, New York, United States",,Active,For Profit,,,2021-01-01,year,"Air Transportation, Ticketing, Transportation"
