Kyte Dynamics,https://www.crunchbase.com/organization/kyte-dynamics,"Walnut, California, United States","Kyte Dynamics develops an aerial delivery and logistics solution. Its platform helps to deliver from warehouses, restaurants, and retail within minutes at delivery prices, navigation apparatus for unmanned aerial vehicles, software for operating, maintaining, monitoring, logging autonomous aircraft. Founded in 2021, the company is based in Walnut,  California, United States.",Active,For Profit,,,2021-01-01,year,"Air Transportation, Autonomous Vehicles, Logistics"
Ocean Camera Space Corp,https://www.crunchbase.com/organization/ocean-camera-space-corp,"Brownsville, Texas, United States","The goal of Ocean Camera Space is to video every ocean in the solar system and harvest the water, to sustain human life in space.",Active,For Profit,,,2021-09-28,day,"Aerospace, Photography, Satellite Communication, Space Travel"
Socian Technologies,https://www.crunchbase.com/organization/socian-technologies,"Chicago, Illinois, United States",Socian is a pre-revenue tech startup building autonomous drone systems that serve as the ultimate accountability tool for safer community policing. AI adds value to our systems by tracking suspects at large and identifying weapons while supporting both law enforcement and commercial customers to save lives.,Active,For Profit,Pre-Seed,"Black / African American Founded, Black / African American Led",2021-02-10,day,"Aerospace, Artificial Intelligence, Drones, Machine Learning, Software"
Viridian Space,https://www.crunchbase.com/organization/viridian-space,"Culver City, California, United States","Viridian Space develops a propulsion technology intended to use oxygen to stay in ultra-low earth orbit. The company was founded in 2021 and is based in Culver City, California.",Active,For Profit,,,2021-01-01,year,"Aerospace, Manufacturing, Space Travel"
Spright,https://www.crunchbase.com/organization/spright-a7ed,"Gilbert, Arizona, United States","Spright offers streamlined and sustainable solutions to overcome the everyday challenges of inefficient ground operations. They apply groundbreaking technology and an innovative service model. They provide unmanned aerial systems (UAS) end-to-end solutions that are revolutionizing healthcare delivery and utility inspections. They use their operational expertise in autonomous, bidirectional, and beyond-visual line-of-sight drone solutions to help them rise above their business challenges.",Active,For Profit,,,2021-01-01,year,"Air Transportation, Drones, Health Care"
UFO,https://www.crunchbase.com/organization/ufo,"Sunnyvale, California, United States",,Active,For Profit,,,2022-07-01,day,"Aerospace, Blockchain, Data Center, Government, Military, Satellite Communication, Space Travel"
Lesath International Inc,https://www.crunchbase.com/organization/lesath-international-inc,"Buffalo, New York, United States","Lesath operates as a Space transportation and exploration company which researches, designs and manufacture next-Gen reusable space launch vehicles. The company was founded in 2021  and is currently headquartered in Buffalo, NY.",Active,For Profit,,,2021-04-15,day,"Aerospace, Manufacturing, Space Travel, Transportation"
Airblox,https://www.crunchbase.com/organization/airblox,"Illinois City, Illinois, United States",,Active,For Profit,,,2021-01-01,year,"Air Transportation, Logistics, Transportation"
EMS Team,https://www.crunchbase.com/organization/ems-team,"Circleville, Ohio, United States",,Active,For Profit,,,2021-01-01,year,"Air Transportation, Emergency Medicine, Health Care, Transportation"
Ember Flash Aerospace,https://www.crunchbase.com/organization/ember-flash-aerospace,"Boulder Creek, California, United States","Ember Flash Aerospace's innovative technology aims to revolutionize wildfire management by utilizing Ultra Long Endurance UAVs and combining multiple data streams from various sources. Their proprietary Generative AI platform can process and analyze this data in real time, providing actionable insights to firefighters on the ground. In addition to its own data sources, Ember Flash Aerospace integrates data from a wide range of public and private sources, including satellite imagery, smoke cameras, and weather data, to create a comprehensive picture of the wildfire situation. The company's Ultra Long Endurance UAVs can fly or hover over specific zones for extended periods, allowing them to gather and transmit data continuously. Through their research, Ember Flash Aerospace has found that their UAVs can detect the spread of fires and accurately map the affected areas, providing real-time data and insights that will help firefighters strategize and plan their firefighting efforts more effectively. Their Generative AI platform will also help firefighters identify areas where people may be trapped or need assistance, allowing them to direct their efforts more efficiently. With its experienced management team, strong financial projections, and cutting-edge technology, Ember Flash Aerospace is well-positioned for long-term success and growth in the disaster response industry. By leveraging the power of Ultra Long Endurance UAVs and Generative AI mapping and decision-making, Ember Flash Aerospace looks forward to making a significant impact in the fight against wildfires and revolutionizing the way we approach disaster response.",Active,For Profit,,,2021-08-01,day,"Aerospace, Artificial Intelligence, Drones, Information Technology, Predictive Analytics, SaaS, Software"
Luftcar,https://www.crunchbase.com/organization/luftcar,"Orlando, Florida, United States",,Active,For Profit,,,2021-01-01,year,"Aerospace, Autonomous Vehicles, Fuel, Transportation"
VMO Aircraft Leasing,https://www.crunchbase.com/organization/vmo-aircraft-leasing,"San Francisco, California, United States",,Active,For Profit,,,2021-01-01,year,"Aerospace, Air Transportation, Leasing"
Karman+,https://www.crunchbase.com/organization/karman,"Denver, Colorado, United States","Karman+ is a company focused on near-earth asteroid mining for carbon neutral and sustainable energy and resources. As opposed to other space mining companies whose initial goal is mineral and metal mining, Karman+ plans to begin with mining for water and kickstart a flywheel cis-lunar economy.",Active,For Profit,,,2021-01-01,year,Aerospace
Axta Space,https://www.crunchbase.com/organization/axta-space,"Arlington, Virginia, United States",Axta Space delivers optical solutions for space communications. Axta's vision is to enable a space-based network of nodes that provide fiber-speed data connectivity.,Active,For Profit,,,2022-01-01,year,"Aerospace, Communications Infrastructure, Optical Communication"
Airhart Aeronautics,https://www.crunchbase.com/organization/airhart-aeronautics,"San Francisco, California, United States","Airhart Aeronautics creates semi-autonomous airplanes that make it easier for pilots to operate their own planes. Airhart airplanes use a fault-tolerant fly-by-wire control technology that streamlines all stages of flying. Comprehensive testing are integrated into the design from the outset, guaranteeing that every flight is safe. Airhart Aeronautics was founded in 2022.",Active,For Profit,Venture - Series Unknown,,2022-01-01,year,"Aerospace, Autonomous Vehicles, Manufacturing"
Aeroplicity,https://www.crunchbase.com/organization/aeroplicity,"Sacramento, California, United States","Aeroplicity is an innovative aerospace & defense technology startup building the world's first blockchain-backed aerospace & defense platform made for small to medium-sized businesses alongside its Traceability (as a service) application which simplifies the process of creating, managing, and sharing traceability documentation. It enables businesses to create digital twins of their documentation, which can be easily shared through QR codes, eliminating the need for physical copies. The use of blockchain technology ensures the authenticity of the documentation and improves supply chain transparency, speed, and efficiency.",Active,For Profit,,,2023-01-04,day,"Aerospace, Government, Military, SaaS, Software"
Downmass,https://www.crunchbase.com/organization/downmass,"Los Angeles, California, United States",Downmass is a NewSpace company dedicated to bringing all forms of mass back to earth (and beyond).,Active,For Profit,,,2022-01-01,year,"Aerospace, Industrial, Military, National Security, Space Travel"
Applied Physics,https://www.crunchbase.com/organization/applied-physics,"New York, New York, United States","Applied Physics, PBC. is an independent group of scientists and engineers that advise companies and governments on science and technology for both humanitarian and commercial applications. Privately funded and self-sustaining through the company's patent portfolio, Applied Physics is a physics think tank structured to be wholly independent of any academic or government body, allowing the organization to pursue research solely for the public good. We are headquartered in Stockholm, Sweden, with offices in Manhattan.",Active,For Profit,,,2021-01-01,year,"Aerospace, Civil Engineering, Mechanical Engineering, Military, Space Travel"
Signia Aerospace,https://www.crunchbase.com/organization/signia-aerospace,"Vancouver, Washington, United States",Signia Aerospace is a manufacturer of high-performance aerospace systems and specialized components.,Active,For Profit,,,2021-01-01,year,"Aerospace, Environmental Consulting, Manufacturing"
TRL11,https://www.crunchbase.com/organization/trl11,"Los Angeles, California, United States",,Active,For Profit,,,2022-01-01,year,"Aerospace, Battery, Manufacturing, Sensor"
Beeontrade,https://www.crunchbase.com/organization/beeontrade,"North Bergen, New Jersey, United States","Beeontrade is a full-service global freight forwarder and logistics platform using modern software to fix the user experience in global trade. The platform arranges goods to be transported and tracks the inventory in real-time in orders carried by the ocean, air, and road freight, enabling logistics companies to optimize transportation routes and inventory management. It is a licensed freight forwarder built around a modern platform. At Beeontrade, we empower fast-growing DTC medium enterprises to achieve complete visibility and optimized efficiency of global supply chains and logistics. With a primary focus on Beauty, Retail, Food and FMCG verticals, our customers experience greater flexibility through integration and chain customization for an open, cost-effective global supply chain.  The company was founded in 2021 by Caglar Denel and is based in North Bergen, New Jersey.",Active,For Profit,,,2021-05-14,day,"Air Transportation, Freight Service, Logistics, Marine Transportation, Shipping, Software, Supply Chain Management, Transportation"
Airio,https://www.crunchbase.com/organization/airio,"Oakland, California, United States","Airio is a developer/operator of commercial autonomous aircraft systems, leveraging geospatial intelligence with next-generation automated route optimization for commercial drones and Advanced Air Mobility vehicles (eVTOLs).  Our goal is a comprehensive operational platform that enables a single operator to manage a diverse fleet of 20+ autonomous aircraft, each exercising an independent mission.",Active,For Profit,,,2021-06-01,month,"Aerospace, Air Transportation, Artificial Intelligence, Drone Management, Geospatial, GreenTech, Intelligent Systems, Navigation"
Altaport,https://www.crunchbase.com/organization/altaport,"Salt Lake City, Utah, United States","Altaport is a modern toolset for airport, heliport, and vertiport operations management that enables eVTOL operators to explore, identify and reserve the perfect destination for passengers.",Active,For Profit,,,2021-01-01,year,"Air Transportation, Infrastructure, Operating Systems"
Novus Sentry,https://www.crunchbase.com/organization/novus-sentry,"Oakland, California, United States","Novus Sentry is a battery health diagnostic company. We focus on extending battery life through improved battery safety, quality and reliability. Battery health testing is expensive, time consuming and damaging to batteries - our technology addresses this.  Through a proprietary technology developed alongside world leading battery researchers, our solution rapidly characterizes a battery's health in a way to ensure safety, quality and reliability. Independent of battery chemistry or cell formats, we measure a battery's health up to 1000x faster than current methods. In doing so, we bring dynamic predictive analytics to battery manufacturers, asset owners and end users. Currently we are working on pilots with cell manufacturers and pack integrators and serve private and government partners.",Active,For Profit,Pre-Seed,,2021-01-01,year,"Air Transportation, Battery, Electric Vehicle, Energy Storage, Renewable Energy"
Galactiv,https://www.crunchbase.com/organization/galactiv,"Austin, Texas, United States",Galactiv is enabling sustainable commercial activities in outer space through satellite servicing and salvage operations. We enable the continued operation of existing assets and create additional revenue generation opportunities for satellite operators. Our services also provide an affordable source of raw materials for on-orbit manufacturing companies and other space infrastructure developers.,Active,For Profit,,,2021-02-01,day,"Aerospace, National Security, Space Travel"
Beacon AI,https://www.crunchbase.com/organization/beacon-ai,"San Francisco, California, United States",Beacon AI is building the future of flight safety for commercial and private fleets.,Active,For Profit,Seed,,2021-01-01,year,"Air Transportation, Artificial Intelligence, Big Data"
Revv Aviation,https://www.crunchbase.com/organization/revv-aviation,"Sugar Grove, Illinois, United States",,Active,For Profit,,,2022-01-01,year,"Aerospace, Education, Training"
Ravati Aerospace,https://www.crunchbase.com/organization/ravati-aerospace,"Norcross, Georgia, United States","Our flagship product is a modern UAV design using existing aerodynamic and mechanical design. Currently the UAV industry has attempted to use current technologies and apply them to a new problem. However, what should and needs to be done is use current technology in a new and innovative fashion. We're using modern methodology and technique to view the box from a different perspective without breaking principles. Our technology implies high factors of improvement in the areas of range, and maneuverability while combining the advantages of fixed wing and rotary wing flight dynamics without the negative effects of each. The true engineering is putting all the components together not simply to make a UAV but a robotic aerial vehicle that will usher us into a new frontier of possibility and infrastructure.",Active,For Profit,,,2021-05-01,month,"Aerospace, Air Transportation, Automotive, Autonomous Vehicles, Drone Management, Drones, Last Mile Transportation, Logistics, Robotics, Transportation"
A-BRIDGE,https://www.crunchbase.com/organization/a-bridge-c9d8,"Indianapolis, Indiana, United States","A-BRIDGE is a passenger boarding bridge refurbishment and installation company. They provide passenger boarding bridges, passenger refurbishment, maintenance, and relocation services. The company is developing the link for airports and airlines around passenger boarding bridges by provide component support, upkeep services, and complete boarding bridge renovations.",Active,For Profit,,,2022-01-01,year,"Aerospace, Consulting, Industrial, Product Design"
Estes Energetics,https://www.crunchbase.com/organization/estes-energetics,"Penrose, Colorado, United States","Estes Energetics offers solid rocket motors and aerospace systems. Their services include rocket motors, aerospace, research and development, aerospace propulsion, vehicle, and system design, system integration, composites, propulsion, hardware testing, aircraft launch, tractor rockets, tactical rockets and missiles, target rockets, cube sats, and small spacecraft.",Active,For Profit,,,2021-01-01,year,"Aerospace, Industrial, Manufacturing"
Welojets,https://www.crunchbase.com/organization/welojets,"Miami, Florida, United States",,Active,For Profit,,,2021-08-01,month,"Aerospace, Air Transportation, Leisure, Travel"
Overhead Intelligence,https://www.crunchbase.com/organization/overhead-intelligence,"Winter Haven, Florida, United States","Overhead Intelligence is a disruptive Geospatial data company, specializing in aerial mapping using drones.",Active,For Profit,,Black / African American Led,2021-05-05,day,"Aerospace, Analytics, Drones, Geospatial, Software"
Uniform Sierra Aerospace,https://www.crunchbase.com/organization/uniform-sierra-aerospace,"West Lafayette, Indiana, United States","Uniform Sierra aims to revolutionize the way Public Safety Officials use drones by creating the adaptability, usability, and cost effectiveness drones will require in the coming decade. We're bringing around the next generation of user-friendly small unmanned aircraft systems (sUAS) through our fast, modern design process and startup mindset.",Active,For Profit,,,2021-04-04,day,"Aerospace, Drones, Manufacturing, Robotics"
7x4flights,https://www.crunchbase.com/organization/7x4flights,"Sheridan, Wyoming, United States",,Active,For Profit,,,2021-01-01,year,"Air Transportation, Hotel, Travel Accommodations, Travel Agency, Vacation Rental"
Airspace Data,https://www.crunchbase.com/organization/airspace-data,"Chicago, Illinois, United States","Airspace Data provides an automated, auditable airspace data sharing solution.",Active,For Profit,,,2021-01-01,year,"Aerospace, Analytics, Information Technology"
"Atlantis Industries, Inc.",https://www.crunchbase.com/organization/atlantis-industries-inc,"San Antonio, Texas, United States","Atlantis Industries, Inc. is a 3D systems modeling, simulation, and engineering company powered by artificial intelligence. Founded 2020 and is based in San Antonio, Texas.",Active,For Profit,,,2021-01-01,year,"Aerospace, Artificial Intelligence, Manufacturing"
OrbitsHub,https://www.crunchbase.com/organization/orbitshub,"San Francisco, California, United States","OrbitsHub is a technology startup providing Tracking and Monitoring end-to-end solutions using Automation, Artificial Intelligence & Machine Learning tools. Our technology will be serving worldwide customers by empowering them with our intelligent solutions.",Active,For Profit,,,2021-08-01,day,"Aerospace, Artificial Intelligence, Machine Learning, Satellite Communication, Software, Space Travel"
Safe Air Mobility,https://www.crunchbase.com/organization/safe-air-mobility,"Mishawaka, Indiana, United States",Safe Air Mobility (SAM) provides tailored insurance and safety solutions for drones & eVTOLs. SAM offers safety assessment for drone & eVTOL operations and evaluates risks of drone & eVTOL flights in any environment.,Active,For Profit,,,2022-01-01,month,"Air Transportation, Insurance, InsurTech"
Ryse Aerotech,https://www.crunchbase.com/organization/ryse-aerotech,"Mason, Ohio, United States",Ryse Aerotech develops and builts ultralight Electric Vertical Takeoff & Landing vehicles (eVOLT) vehicles - RYSE RECON.,Active,For Profit,,,2021-01-01,year,"Aerospace, Information Technology"
Aviation.One,https://www.crunchbase.com/organization/aviation-one,"Mesa, Arizona, United States",,Active,For Profit,,,2022-01-01,day,"Aerospace, Angel Investment, Funding Platform"
NANCo Aero,https://www.crunchbase.com/organization/nanco-aero,"Houston, Texas, United States","NANCo Aero provides products such as advanced air vehicles and drones that are built for reliability and feature services such as research and development, product development, and skills and technology consulting. Their modern aircraft transports its passengers to their destination via pilot, remote pilot, and autonomous systems.",Active,For Profit,,,2021-01-01,year,"Aerospace, Air Transportation, Customer Service, Drones"
Aerovek Aviation,https://www.crunchbase.com/organization/aerovek-aviation,"Chico, California, United States","aerovek aviation offers a host of features that made building on their blockchain the clear choice for aerovek aviation, and support for android and ios,  that is making private aviation accessible to anyone and provides social economic services.",Active,For Profit,,,2021-01-01,year,"Aerospace, Blockchain, Sharing Economy, Social"
Overview Energy,https://www.crunchbase.com/organization/overview-energy,"Washington, District of Columbia, United States",,Active,For Profit,Undisclosed,,2022-01-01,year,"Aerospace, Hardware, Satellite Communication"
WorkForYourWorld.com,https://www.crunchbase.com/organization/oneminute-2,"San Francisco, California, United States",,Active,For Profit,,,2021-02-01,day,"Aerospace, Communities, Content Discovery, Content Marketing, Recruiting, Software, Sustainability, Video"
Ocean Blue Express,https://www.crunchbase.com/organization/ocean-blue-express,"Compton, California, United States",,Active,For Profit,,,2021-01-01,year,"Air Transportation, Freight Service, Transportation, Warehousing"
Hanwha Cimarron,https://www.crunchbase.com/organization/hanwha-cimarron,"Opelika, Alabama, United States","Hanwha Cimarron offers hydrogen filling stations and plans to expand into tanks. They offer aerospace applications and cargo ships carrying liquefied natural gas. they also offer optimised solutions catered to aerospace, aviation, drone, and marine applications. Their services include covering various applications, from oxygen flasks to storage for shipping vessels.",Active,For Profit,,,2021-01-01,year,"Aerospace, Marine Transportation, Oil and Gas"
Beech Systems,https://www.crunchbase.com/organization/beech-systems,"Los Angeles, California, United States",Beech Systems is a stealth-mode startup that creates solutions and products to transform the aerospace industry.,Active,For Profit,,,2022-01-01,year,"Aerospace, Industrial Engineering, Information and Communications Technology (ICT)"
AeroConsummate Advisors,https://www.crunchbase.com/organization/aeroconsummate-advisors,"Dallas, Texas, United States","AeroConsummate Advisors provides business aviation, commercial, military, applications, propulsion MRO manufacturing, global supply chain, asset management planning, engineering, product development, component repair, aviation regulatory, and trade compliance services.",Active,For Profit,,,2022-01-01,year,"Advice, Aerospace, Commercial"
WingIt,https://www.crunchbase.com/organization/wingit-32cd,"Jacksonville, Florida, United States",,Active,For Profit,,,2021-01-01,month,"Aerospace, Mobile Apps, Travel"
Luxury Rides,https://www.crunchbase.com/organization/luxury-rides,"Denver, Colorado, United States",,Active,For Profit,,,2022-01-01,year,"Air Transportation, Events, Transportation"
Happy Takeoff,https://www.crunchbase.com/organization/happy-take-off,"Dallas, Texas, United States",,Active,For Profit,,,2021-01-01,day,Aerospace
"Cyclo Technologies, Inc.",https://www.crunchbase.com/organization/cyclo-technologies-inc,"Roswell, Georgia, United States",Space Electronics Design,Active,For Profit,,,2022-02-28,day,Aerospace
Giuseppe Space Enterprises,https://www.crunchbase.com/organization/giuseppe-space-enterprises,"Colorado Springs, Colorado, United States",,Active,For Profit,,,2022-01-01,year,"Aerospace, Commercial"
Stella Jets,https://www.crunchbase.com/organization/stella-jets,"Southlake, Texas, United States",,Active,For Profit,,,2021-01-01,year,"Aerospace, Air Transportation, Travel"
Legacy Flight Group,https://www.crunchbase.com/organization/legacy-flight-group,"Orlando, Florida, United States",,Active,For Profit,,,2022-01-01,year,"Air Transportation, Transportation, Travel"
Avionic,https://www.crunchbase.com/organization/avionic,"Houston, Texas, United States","Avionic is a Houston-based C-Corp that provides a technology solution to increase efficiency in real-time through digital twins, thus determining patterns and trends in intelligent mobility and its potential changes. It is essential that the future of our mobility will be autonomous, connected, and with zero emissions, but air travel is difficult to access for people and highly polluting. We want to make these services easy to access and sustainable, creating a management assistant that optimizes resources and time through a digital simulation environment. Zero is Avionic's end-to-end decarbonization solution, with a carbon-credit trading platform to meet climate disclosure requests and support the progress to net-zero. Pass is Avionic's payments management solution with a quick access tool in travels, helping to access without complex logs and optimize time for a better user experience.",Active,For Profit,,,2021-09-09,day,"Air Transportation, Biofuel, Energy Efficiency, Information Technology, Mobile Payments, Renewable Energy, Simulation, Smart Cities"
NorthLink Aviation,https://www.crunchbase.com/organization/northlink-aviation,"Anchorage, Alaska, United States",NorthLink Aviation holds a 55-year lease for the 120-acre South Park Campus and is developing critical airport infrastructure at the site to support growing cargo volumes at ANC.,Active,For Profit,Venture - Series Unknown,,2021-01-01,year,"Aerospace, Air Transportation"
Avatrade,https://www.crunchbase.com/organization/avatrade-b181,"Coral Gables, Florida, United States","Avatrade is the transparent e-commerce marketplace to help airlines and repair facilities purchase the best part at the best price, and reduce aircraft downtime and lost revenue.",Active,For Profit,,,2021-03-03,day,"Aerospace, E-Commerce, Marketplace"
